名称,英文名,id,poiID,经度,维度,标签,特色,价格,最低价格,评价分数,评论数量,封面图片,成人票价格,老人票价格,学生票价格,儿童票价格,建议游玩,开放时间,介绍,优待政策青云岩,Qingyunyan Scenic Spot,17819,79929,23.277993,116.7457,登高爬山,观天然石洞群上的摩崖石刻,0.0,0,4.3,26,https://dimg04.c-ctrip.com/images/100l1a0000019ib29106B.jpg,0,0,0,0,3小时,"{'openStatus': '今日已闭园', 'openStatusType': 1, 'canSubscribed': False, 'hasSubscribed': False, 'likeCount': 0, 'isLiked': False, 'playSpendTime': '3小时', 'openTimeDesc': '全年 08:00-18:00', 'openDateRuleInfo': [{'dateDesc': '全年', 'isCurrentTime': False, 'openWeekRuleInfo': [{'weekDesc': '08:00-18:00'}]}]}",位于濠江区大望峰山腰，依天然石洞建成，有历代摩崖石刻近百处，有“海国风光第一山”之称。自明代中叶起，佛教和道教相继在山上建筑殿堂，山上的云岩禅林，虽为佛殿却又与道家的玄武庙相对。山脚的道观里也供奉着佛祖塑像，体现了潮汕地区佛道不分的特点。山下山楼阁岩洞，回环宛转，有飞泉溅石成声，铿锵有致，故命为“龙泉琴韵”，此地有茶室可供游人休憩。青云岩风景区十八石洞群古榕茂盛，山洞迂回曲折、曲径通幽。惟妙惟肖的假山小景、古代传奇故事壁画、千姿百态的先人墨迹等随处可见。,{}
南溪水乡,Nanxi Shuixiang,130369060,130369060,23.499432,116.248201,,,0.0,0,2.0,6,https://youimg1.c-ctrip.com/target/0102c1200095inqdhBE04.png,220.0,220.0,220.0,220.0,,,,{}
汕头星空梦幻城,Shantou Starry Dream City,5677393,77462184,23.376843,116.723255,特色展馆,,0.0,0,4.4,14,https://youimg1.c-ctrip.com/target/3508190000017z2gtB40B.jpg,0,0,0,0,1-3小时,"{'openStatus': '', 'openStatusType': 999, 'canSubscribed': False, 'hasSubscribed': False, 'likeCount': 0, 'isLiked': False, 'playSpendTime': '1-3小时'}",一场惊奇际遇的视觉盛宴，美到窒息，美到炸裂！承包一整片唯美浪漫的星空给你，“摘下星星给你”的美好愿望终于触手可及！每一个场馆都诠释着不同主题，各有特色，让人看得移不开眼～,{}
明安里,Ming'anli Scenic Spot,1647071,18413401,23.300098,116.433564,文化古迹|演出场馆,,0.0,0,4.4,14,https://youimg1.c-ctrip.com/target/10090t000000icjpgF835.jpg,0,0,0,0,2-3小时,"{'openStatus': '', 'openStatusType': 999, 'canSubscribed': False, 'hasSubscribed': False, 'likeCount': 0, 'isLiked': False, 'playSpendTime': '2-3小时'}",明安里位于汕头市潮阳区铜盂镇洋美村（俗名洋尾寮），是一处以的潮汕传统民居为主题的旅游景点，占地50多亩，其主体建筑由八座潮汕传统民居“四点金”、和一座后库环绕一座祠堂而共同构成，在潮汕民居中属于“九龙吐珠”格局。各座四点金均采用灰木琉璃瓦结构，梁架之间饰以鲜艳的潮州金漆木雕和油画彩绘，屋脊飞檐配以潮州嵌瓷点缀。另外还有泥粉画、石刻等潮汕民间传统工艺，故也被誉为“潮汕民俗文化之窗”。而牌匾和壁联是邀请史树青、沈鹏、孙秩青、单国强、王学仲、王琦、刘大为、佟韦、聂成文、陈政明、肖映川等数十位现代书画家题写的。,{}
凤凰塔,Fenghuangta,1830474,24649683,23.647257,116.65867,文化古迹,,0.0,0,4.5,6,https://dimg04.c-ctrip.com/images/100u1900000163br66DEF.jpg,0,0,0,0,0.5-2小时,"{'openStatus': '', 'openStatusType': 999, 'canSubscribed': False, 'hasSubscribed': False, 'likeCount': 0, 'isLiked': False, 'playSpendTime': '0.5-2小时', 'openTimeDesc': '具体营业状态以当天开放情况为准。'}",凤凰塔得名于其面对凤凰山、毗邻凤凰台，始建于明万历年间，后又重修。塔高四十余米，塔身坚固，雄伟壮观。塔身雕刻着龙、凤、鹤、马、羊等各种祥禽瑞兽，工艺精美。,{}
红山森林公园,Guangdong Hongshan Forest Park,1829932,24649035,23.674315,116.709385,森林草原|演出场馆,,0.0,0,1.4,6,https://youimg1.c-ctrip.com/target/0103412000a5vy51i6C2A.jpg,0,0,0,0,0.5-1天,"{'openStatus': '开园中', 'openStatusType': 0, 'canSubscribed': False, 'hasSubscribed': False, 'likeCount': 0, 'isLiked': False, 'playSpendTime': '0.5-1天', 'openTimeDesc': '全年 全天开放', 'openDateRuleInfo': [{'dateDesc': '全年', 'isCurrentTime': False, 'openWeekRuleInfo': [{'weekDesc': '全天开放'}]}]}",红山森林公园位于广东潮州市古城之东，为山地向平原过度的高丘陵，山势峻夷，峰峦叠翠，高树凝烟，景石错立，泉水蜿蜒，高峰海拔约497.2米，雄居山体的中央，为潮州城区的制高点，园区南北约5．22千米，东西宽约4.17千米，总面积933公顷。,{}
下岐尾,Xiaqiwei Village,5680352,77594643,23.283504,116.400701,,,0.0,0,4.3,4,https://youimg1.c-ctrip.com/target/1A031a0000018al3806BF.jpg,0,0,0,0,,"{'openStatus': '开园中', 'openStatusType': 0, 'canSubscribed': False, 'hasSubscribed': False, 'likeCount': 0, 'isLiked': False, 'openTimeDesc': '全年 全天开放', 'openDateRuleInfo': [{'dateDesc': '全年', 'isCurrentTime': False, 'openWeekRuleInfo': [{'weekDesc': '全天开放'}]}]}",,{}
汕头市革命历史博物馆,Shantoushi Geming Lishi Museum,5701180,79137500,23.35577,116.690421,演出场馆,,0.0,0,5.0,1,https://dimg04.c-ctrip.com/images/0106x12000bts3lsa167A.jpg,0,0,0,0,1-2小时,"{'openStatus': '今日已闭园', 'openStatusType': 1, 'canSubscribed': False, 'hasSubscribed': False, 'likeCount': 0, 'isLiked': False, 'playSpendTime': '1-2小时', 'openTimeDesc': '全年 周二-周日 9:00-16:30', 'openDateRuleInfo': [{'dateDesc': '全年', 'isCurrentTime': False, 'openWeekRuleInfo': [{'weekTime': '周二至周日', 'weekDesc': '9:00-16:30'}]}]}",汕头市革命历史博物馆通过文献、照片、实物等形式，展示了一些历史故事，非常具有教育意义。,{}
汕头海兴路废弃铁轨,,5713801,102563026,23.350081,116.749124,,,0.0,0,4.3,7,https://youimg1.c-ctrip.com/target/01073120008k24gp76841.jpg,0,0,0,0,1-2小时,"{'openStatus': '', 'openStatusType': 999, 'canSubscribed': False, 'hasSubscribed': False, 'likeCount': 0, 'isLiked': False, 'playSpendTime': '1-2小时', 'openTimeDesc': '具体营业状态以当天开放情况为准'}",汕头海兴路废弃铁轨已不再使用，铁轨两侧长满了美丽的花朵，再加上周边迷人的景色，使得这里非常适合拍摄有氛围感的照片。,{}
郑皇达信公园,Zhenghuangdaxin Park,4338347,47201163,23.493744,116.765258,演出场馆,,0.0,0,4.0,4,https://youimg1.c-ctrip.com/target/0101o12000as2adsq2648.jpg,0,0,0,0,2-3小时,"{'openStatus': '', 'openStatusType': 999, 'canSubscribed': False, 'hasSubscribed': False, 'likeCount': 0, 'isLiked': False, 'playSpendTime': '2-3小时', 'openTimeDesc': '具体营业状态以当天开放情况为准'}",郑信是历史上唯一在外国当上皇帝的中国人，他的衣冠冢位于澄海区华富村，当地政府为其修建“郑皇达信公园”。,{}
盛莲公园,,130368238,130368238,23.386722,116.773531,演出场馆,,0.0,0,0.0,0,https://youimg1.c-ctrip.com/target/0105a1200095d51ks42AB.png,0,0,0,0,,"{'openStatus': '暂停营业', 'openStatusType': 4, 'openTime': '营业时间待定', 'canSubscribed': True, 'hasSubscribed': False, 'likeCount': 0, 'isLiked': False, 'openTimeDesc': '全年 09:00-22:30', 'openDateRuleInfo': [{'dateDesc': '全年', 'isCurrentTime': False, 'openWeekRuleInfo': [{'weekDesc': '09:00-22:30'}]}]}",盛莲公园位于汕头龙湖区南岭路下九合北之二潮府盛莲现代工业产业园内，是个亲子游玩的好去处。,{}
南山虎仔海滩,Nanshanhuzai Beach,2651323,38461862,23.233904,116.701351,海滨沙滩,,0.0,0,0.0,0,https://youimg1.c-ctrip.com/target/0105012000a4m4q7wDEA4.png,0,0,0,0,2-3小时,"{'openStatus': '开园中', 'openStatusType': 0, 'canSubscribed': False, 'hasSubscribed': False, 'likeCount': 0, 'isLiked': False, 'playSpendTime': '2-3小时', 'openTimeDesc': '全年 全天开放', 'openDateRuleInfo': [{'dateDesc': '全年', 'isCurrentTime': False, 'openWeekRuleInfo': [{'weekDesc': '全天开放'}]}]}",南山虎仔海滩位于汕头市濠江区，这里的海滩弯如新月，水质清澈、沙滩细软，还可以尽情领略礁石的神奇。,{}
凤岗古村,Fenggang Village,1646954,18413525,23.269483,116.721094,古镇古村|演出场馆,,0.0,0,4.1,13,https://youimg1.c-ctrip.com/target/0100p12000as4sc2zF140.jpg,0,0,0,0,1-2小时,"{'openStatus': '开园中', 'openStatusType': 0, 'canSubscribed': False, 'hasSubscribed': False, 'likeCount': 0, 'isLiked': False, 'playSpendTime': '1-2小时', 'openTimeDesc': '全年 全天开放', 'openDateRuleInfo': [{'dateDesc': '全年', 'isCurrentTime': False, 'openWeekRuleInfo': [{'weekDesc': '全天开放'}]}]}",汕头市濠江区凤岗古村落建于公元1319年，现存古建筑主要为清末时期的，基本保存完好。地处濠江马滘街道东南部，乡域面积约4平方公里，居住人口7000人左右。近年来，马滘街道通过加强宣教与推介力度、健全与完善保护机制、加大资金投入力度等一系列措施保护凤岗古村落，2010年，“凤岗珍珠娘娘庙会”被列为汕头市非物质文化遗产。2013年1月，凤岗古村落被列为广东省古村落。2014年1月被中国民间文艺家协会正式命名为“中国古村落”。凤岗村历史悠久，古建筑遗存丰富，古民居保存完整，是粤东地区一个独具魅力的滨海古渔村。凤岗古村按照潮汕传统民居建筑风格布局，依凤岗山而建，错落有致，古朴简约，体现着深厚的宗族观念。凤岗村历经数百年的发展和积淀，素有崇文重教传统，民俗文化底蕴深厚，凤岗珍珠娘娘庙会和龙舟比赛享誉潮汕。走进凤岗村，除了观赏潮涨潮落，聆听涛声拍岸，散落在古村各处的怪石嶙峋、古榕苍苍也是不容错过的独特风景。“凤岗多奇石”，这里的妈印石、龟蟹石、蛇头石、点炮石不仅形状奇特，还被赋予了很多神话传说。,{}
太安堂中医药博物馆,Tai'antang Zhongyiyao Museum,1646886,18411662,23.396058,116.680298,博物馆|演出场馆,,0.0,0,4.4,13,https://youimg1.c-ctrip.com/target/0104512000apjalb0315B.jpg,0,0,0,0,1-2小时,"{'openStatus': '今日已闭园', 'openStatusType': 1, 'canSubscribed': False, 'hasSubscribed': False, 'likeCount': 0, 'isLiked': False, 'playSpendTime': '1-2小时', 'openTimeDesc': '全年 周二-周日 8:30-17:00', 'openDateRuleInfo': [{'dateDesc': '全年', 'isCurrentTime': False, 'openWeekRuleInfo': [{'weekTime': '周二至周日', 'weekDesc': '8:30-17:00'}]}]}",太安堂中医药博物馆以潮州柯氏13代中医药世家的历史渊源和太安堂发展轨迹作为陈列主线，展示了大量珍贵的太安堂历代传人从事医药业的重要文物，包括柯氏家族秘藏的中医药器物如明清时期的诊疗器具、古旧医书、丹膏丸散炮制器具、老照片、老药品、旧家具、牌匾等。本馆充分展示太安堂13代近五百年传承的中医药文化底蕴，并将中医药特色、潮汕特色和太安堂特色融为一体，向游客展示出一幅祖国中华医药长河中的瑰丽画卷。太安堂中医药博物馆总占地面积约15亩，总建筑面积超过两万平方米，展区面积达3200平方米。馆内共分为八个展区：1.杏林宗师（玉井公雕像）：太安堂创始人柯玉井公全身塑像，高5.3米，用1000多年树龄的樟木完整雕琢而成。2.神医妙手（神医馆）：分为太安堂传人馆、珍宝馆和族望馆，其中12尊太安堂传人紫檀木雕像、太安堂针灸铜人等颇为引人注目。3.灵丹圣药（圣药殿）4.药王宝殿：供奉中华人文始祖伏羲、神农和黄帝的雕像，左右分置孙思邈、万邦宁等医圣药王塑像，神态各异，栩栩如生。5.翰墨兰芳（含藏书阁、碑林、楹联、牌匾）：藏书阁收藏和展示了柯氏13代珍藏、保留下来的珍贵医书和报刊，多达3000余册，有些已经成为孤本。6.圣母送子7.太安崛起（现代太安堂、太安名药街）：本区集中展示现代太安堂企业文化、管理哲学以及数十年来所获得的荣誉。8. 麒麟玉燕,{}
青云禅寺,,131917530,131917530,23.278566,116.742923,,,0.0,0,0.0,0,https://youimg1.c-ctrip.com/target/01A1j120009dygklxB033.jpg,0,0,0,0,,,,{}
潮州嵌瓷博物馆,Chaozhouqianci Museum,4553539,51551373,23.53844,116.602748,博物馆|演出场馆,,0.0,0,0.0,0,https://youimg1.c-ctrip.com/target/01024120009zin3c16C9D.jpg,0,0,0,0,1-2小时,"{'openStatus': '', 'openStatusType': 999, 'canSubscribed': False, 'hasSubscribed': False, 'likeCount': 0, 'isLiked': False, 'playSpendTime': '1-2小时'}",嵌瓷博物馆是一个古色古香的四合院建筑，里面有亭台楼阁，小桥流水，红色灯笼等。博物馆里面有两个展厅，主要展示一些嵌瓷工艺品，是一个了解嵌瓷的好地方。,{}
北阁佛灯,Beige Buddha Lamp,1714844,22867421,23.673338,116.650955,文化古迹|演出场馆,亭台楼阁间高低错落,0.0,0,4.1,25,https://youimg1.c-ctrip.com/target/01A44120008mc7if4792C.jpg,0,0,0,0,0.5天,"{'openStatus': '今日已闭园', 'openStatusType': 1, 'canSubscribed': False, 'hasSubscribed': False, 'openTimeTips': '具体开放时间以景区当日实际情况为准。', 'likeCount': 0, 'isLiked': False, 'playSpendTime': '0.5天', 'openTimeDesc': '全年 周二-周日 09:00-17:00（17:00停止入园） 周一；具体开放时间以景区当日实际情况为准。', 'openDateRuleInfo': [{'dateDesc': '全年', 'isCurrentTime': False, 'openWeekRuleInfo': [{'weekTime': '周二至周日', 'weekDesc': '09:00-17:00(最晚入园17:00)'}, {'weekTime': '周一', 'weekDesc': '不开放'}]}]}","北阁佛灯是金山东面的一组楼阁的总称。 这里地理位置十分独特，古城墙在此揽绕金山，亭台楼阁间高低错落，曲径幽深，东临急转直下的韩江江水，高览低俯均是别致景色，堪称岭南的一绝。凳临北阁，北堤上“鳄渡秋风”，隔江相望的“韩词橡木”，韩江下游的“湘桥春涨”与“凤凰时雨”诸多胜景历历在目,俯览韩江，江水滔滔，白帆点点。",{}
汕头市开埠历史文化保护区,"Port Opening Historical and Cultural Protection Zone, Shantou",4279372,45012158,23.352312,116.673849,演出场馆,,0.0,0,4.2,11,https://dimg04.c-ctrip.com/images/100f0p000000fptz01633.jpg,0,0,0,0,0.5-1天,"{'openStatus': '开园中', 'openStatusType': 0, 'canSubscribed': False, 'hasSubscribed': False, 'likeCount': 0, 'isLiked': False, 'playSpendTime': '0.5-1天', 'openTimeDesc': '全年 全天开放', 'openDateRuleInfo': [{'dateDesc': '全年', 'isCurrentTime': False, 'openWeekRuleInfo': [{'weekDesc': '全天开放'}]}]}",游览汕头开埠历史文化景观，体验潮俗文化。,{}
东山风景区,,120422048,120422048,23.266973,116.616163,登高爬山,,0.0,0,0.0,0,https://dimg04.c-ctrip.com/images/0105m120008qfznwe1AC7.png,0,0,0,0,,,,{}
叮当猫儿童主题乐园,,5716552,129377953,23.387265,116.713181,儿童乐园,,0.0,0,0.0,0,https://dimg04.c-ctrip.com/images/0106012000bnbo46h6443.jpg,0,0,0,0,3-4小时,"{'openStatus': '开园中', 'openStatusType': 0, 'canSubscribed': False, 'hasSubscribed': False, 'likeCount': 0, 'isLiked': False, 'playSpendTime': '3-4小时', 'openTimeDesc': '全年 10:30-22:00', 'openDateRuleInfo': [{'dateDesc': '全年', 'isCurrentTime': False, 'openWeekRuleInfo': [{'weekDesc': '10:30-22:00'}]}]}",叮当猫儿童乐园作为时尚科学的儿童亲子游乐场所，针对儿童提供健康、安全、益智、娱乐为一体的游乐设施体验。,{}
汕头消防史馆,Shantou Fire History Museum,5701137,79137545,23.355313,116.676595,演出场馆|特色展馆,,0.0,0,4.0,3,https://dimg04.c-ctrip.com/images/01006120009pqaxwlC447.jpg,0,0,0,0,,"{'openStatus': '今日已闭园', 'openStatusType': 1, 'canSubscribed': False, 'hasSubscribed': False, 'likeCount': 0, 'isLiked': False, 'openTimeDesc': '全年 9:00-21:00', 'openDateRuleInfo': [{'dateDesc': '全年', 'isCurrentTime': False, 'openWeekRuleInfo': [{'weekDesc': '9:00-21:00'}]}]}",,{}
惠来滨荷湾旅游景区,Huilai Binhai Lotus Tourism Resort,5716641,129744219,22.935932,116.382015,游山玩水,,0.0,0,4.7,26,https://dimg04.c-ctrip.com/images/0102412000ah5cpwi4BE2.jpg,28.0,14.0,28.0,14.0,2-3小时,"{'openStatus': '开园中', 'openStatusType': 0, 'canSubscribed': False, 'hasSubscribed': False, 'likeCount': 0, 'isLiked': False, 'playSpendTime': '2-3小时', 'openTimeDesc': '全年 09:00-22:00', 'openDateRuleInfo': [{'dateDesc': '全年', 'isCurrentTime': False, 'openWeekRuleInfo': [{'weekDesc': '09:00-22:00'}]}]}",惠来滨海荷花旅游度假区位于惠来县前詹镇沟疏村，项目以保护和治理生态环境，提升产业价值为基础，以建设美丽乡村为设计背景，依托“靠海、土地资源丰富”两大优势，对现有农田进行改造、完善、提升。景区总面积约650亩，项目一期是一个集花海种养、旅游、观光、水上乐园、儿童拓展教育亲子游、婚庆一站式服务、趣味农家乐、田园木屋为一体的小型田园综合体，计划实施项目涵盖水上滑道、七彩滑道、美食街、水上乐园、麻雀石山等内容。,{}
中国进步电影先驱蔡楚生暨潮籍电影名人史迹馆,"Museum of Historical Records of Cai Chusheng, a Pioneer of China’s Progressive Films, and Teochew Film Celebrities",90498395,90498395,23.354452,116.672946,演出场馆,,0.0,0,5.0,1,https://youimg1.c-ctrip.com/target/0100f12000at6b0vn2527.jpg,0,0,0,0,1-2小时,"{'openStatus': '今日已闭园', 'openStatusType': 1, 'canSubscribed': False, 'hasSubscribed': False, 'likeCount': 0, 'isLiked': False, 'playSpendTime': '1-2小时', 'openTimeDesc': '全年 周二-周日 09:00-17:00', 'openDateRuleInfo': [{'dateDesc': '全年', 'isCurrentTime': False, 'openWeekRuleInfo': [{'weekTime': '周二至周日', 'weekDesc': '09:00-17:00'}]}]}",中国进步电影先驱蔡楚生暨潮籍电影名人史迹馆内有很多展品，如拍摄器材、图片、文稿真迹等，通过这些展品，人们可以了解潮籍电影人的生平事迹。,{}
苏埃湾红树林湿地,Su'aiwan Hongshulin Wetland,1646952,18413507,23.322495,116.705106,演出场馆|游山玩水,,0.0,0,1.5,2,https://youimg1.c-ctrip.com/target/01072120008k0ujgg67A8.jpg,0,0,0,0,2-3小时,"{'openStatus': '开园中', 'openStatusType': 0, 'canSubscribed': False, 'hasSubscribed': False, 'likeCount': 0, 'isLiked': False, 'playSpendTime': '2-3小时', 'openTimeDesc': '全年 00:00-23:00', 'openDateRuleInfo': [{'dateDesc': '全年', 'isCurrentTime': False, 'openWeekRuleInfo': [{'weekDesc': '00:00-23:00'}]}]}",位于南滨路的红树林是粤东较大的一片红树林，也是汕头市区仅存的一片天然次生红树林，面积近200亩，有秋茄、桐花树、海、假茉莉、木榄、黄槿、老鼠等红树林种类。更为难得的是，这片树林引来了上千只候鸟，这些候鸟有国家二类保护动物黄嘴白鹭以及灰雁、天鹅等。远远望去，鸟群颜色黑白分明，时而在滩涂悠闲觅食，时而展翅飞上蓝天，使人心旷神怡。,{}
清平乐园,Qingping Paradise,1833136,24652274,23.475,117.11183,度假村,,0.0,0,5.0,1,https://youimg1.c-ctrip.com/target/10030n000000e3cy3CE32.jpg,0,0,0,0,1-2天,"{'openStatus': '', 'openStatusType': 999, 'canSubscribed': False, 'hasSubscribed': False, 'likeCount': 0, 'isLiked': False, 'playSpendTime': '1-2天'}",清平乐园位于汕头市南澳县，设有餐厅、会议室、多功能厅和停车场等。附近还有总兵府、金银岛、南山寺、雄镇关、猎屿等。,{}
太子楼遗址,Taizilou Ruins,4602853,51753943,23.397026,117.106768,演出场馆,,0.0,0,4.0,3,https://youimg1.c-ctrip.com/target/100c1c000001dqx5d644A.jpg,0,0,0,0,1-2小时,"{'openStatus': '今日已闭园', 'openStatusType': 1, 'canSubscribed': False, 'hasSubscribed': False, 'openTimeTips': '具体营业状态以当天开放情况为准', 'likeCount': 0, 'isLiked': False, 'playSpendTime': '1-2小时', 'openTimeDesc': '全年 09:00-17:00（17:00停止售票）；具体营业状态以当天开放情况为准', 'openDateRuleInfo': [{'dateDesc': '全年', 'isCurrentTime': False, 'openWeekRuleInfo': [{'weekDesc': '09:00-17:00(停止售票17:00)'}]}]}",,{}
靖海炮台,Jinghai Fort,2001449,30620956,23.021779,116.560644,文化古迹|演出场馆,,0.0,0,4.3,8,https://dimg04.c-ctrip.com/images/01A2w1200087dxte9BC23.jpg,0,0,0,0,1-2小时,"{'openStatus': '开园中', 'openStatusType': 0, 'canSubscribed': False, 'hasSubscribed': False, 'likeCount': 0, 'isLiked': False, 'playSpendTime': '1-2小时', 'openTimeDesc': '全年 全天开放', 'openDateRuleInfo': [{'dateDesc': '全年', 'isCurrentTime': False, 'openWeekRuleInfo': [{'weekDesc': '全天开放'}]}]}","明洪武二十七年（1369）朝廷逐步总结了军队建设和管理的经验，凡军事上重要的地方都设置卫所。广东都司在此设置千户守御所，隶属于潮州卫，设千户总兵，平息寇患，建置炮台，安静海域，定名“靖海千户守御所”，简称“靖海所”。
据《惠来县志》载：靖海港炮台在靖海港北，距资深炮台5公里，两炮台扼控靖海港，俗称南北炮台，安置大炮8门，有营房18间，驻专防千总1员，兵47名。资深炮台，又称石碑澳炮台，门置大炮6门，有营房18间，驻专防外委1员，兵18名。",{}
云盖寺,Yungaisi,1714923,22867462,23.402743,117.11717,,,0.0,0,4.7,3,https://dimg04.c-ctrip.com/images/10080y000000ls2kb9582.jpg,0,0,0,0,1-2小时,"{'openStatus': '', 'openStatusType': 999, 'canSubscribed': False, 'hasSubscribed': False, 'likeCount': 0, 'isLiked': False, 'playSpendTime': '1-2小时', 'openTimeDesc': '具体营业状态以当天开放情况为准。'}",云盖寺位于广东省汕头市南澳县，始建于宋朝年间，历史悠久，是南澳有名的八景之一。寺院重建后扩建了山门、前后门楼、澄心亭等区域，殿宇雄伟。,{}
西凤村生态公园,,112653575,112653575,23.406907,116.507184,游山玩水,,0.0,0,0.0,0,https://youimg1.c-ctrip.com/target/0104d120008gd8i2f4BA6.jpg,0,0,0,0,,,,{}
潮州动物园,Chaozhou Zoo,5115344,57291101,23.672936,116.642856,,,0.0,0,3.6,5,https://dimg04.c-ctrip.com/images/100d1f000001gorn101FA.jpg,0,0,0,0,2-3小时,"{'openStatus': '', 'openStatusType': 999, 'canSubscribed': False, 'hasSubscribed': False, 'likeCount': 0, 'isLiked': False, 'playSpendTime': '2-3小时', 'openTimeDesc': '具体营业状态以当天开放情况为准。'}",潮州动物园位于潮州西湖公园的北部，临近西湖乐园的半山坡上，动物园的整体面积不大，动物不多，基本上是一些常规的动物，但还是有很多人前往游玩。,{}
西园,,112650447,112650447,23.258974,116.599116,文化古迹|演出场馆,,0.0,0,5.0,2,https://youimg1.c-ctrip.com/target/0103m12000arvatvx875C.jpg,0,0,0,0,,"{'openStatus': '今日已闭园', 'openStatusType': 1, 'canSubscribed': False, 'hasSubscribed': False, 'likeCount': 0, 'isLiked': False, 'openTimeDesc': '全年 08:00-16:00（15:30停止入园）', 'openDateRuleInfo': [{'dateDesc': '全年', 'isCurrentTime': False, 'openWeekRuleInfo': [{'weekDesc': '08:00-16:00(最晚入园15:30)'}]}]}",,{}
云深古寺,Yunshengu Temple,4602854,51753945,23.435814,117.102705,,,0.0,0,2.5,2,https://dimg04.c-ctrip.com/images/fd/tg/g1/M03/FC/25/CghzflW7IAuAQo9CAAA7OIqXlVA798.jpg,0,0,0,0,1-2小时,"{'openStatus': '', 'openStatusType': 999, 'canSubscribed': False, 'hasSubscribed': False, 'likeCount': 0, 'isLiked': False, 'playSpendTime': '1-2小时'}",云深古寺内设有大雄宝殿，僧房等，整体建筑小巧玲珑，飞檐翅角。曲径通幽，郁郁葱葱，风光秀丽。,{}
新津河,,5714185,105934971,23.384008,116.76773,游山玩水,,0.0,0,4.3,11,https://dimg04.c-ctrip.com/images/0105j12000a51brhx5E31.jpg,0,0,0,0,0.5-1小时,"{'openStatus': '', 'openStatusType': 999, 'canSubscribed': False, 'hasSubscribed': False, 'likeCount': 0, 'isLiked': False, 'playSpendTime': '0.5-1小时', 'openTimeDesc': '具体营业状态以当天开放情况为准'}",新津河是当地一条非常重要的内河，有着保障用水、防洪等作用。,{}
凤岗妈湿地公园,Fenggangma Wetland Park,4602741,51753762,23.258952,116.724083,演出场馆|游山玩水,,0.0,0,4.7,7,https://youimg1.c-ctrip.com/target/0101912000a9okiltB610.jpg,0,0,0,0,2-3小时,"{'openStatus': '', 'openStatusType': 999, 'canSubscribed': False, 'hasSubscribed': False, 'likeCount': 0, 'isLiked': False, 'playSpendTime': '2-3小时', 'openTimeDesc': '具体营业状态以当天开放情况为准'}",湿地公园连接着凤岗古城，是一个典型的自然生态湿地和民俗乡土文化融合为一体的公园。,{}
南湖,South Lake,1832600,24651819,23.512105,116.49901,游山玩水,,0.0,0,4.8,4,https://youimg1.c-ctrip.com/target/01054120009zufqde11A1.jpg,0,0,0,0,2-3小时,"{'openStatus': '今日已闭园', 'openStatusType': 1, 'canSubscribed': False, 'hasSubscribed': False, 'likeCount': 0, 'isLiked': False, 'playSpendTime': '2-3小时', 'openTimeDesc': '全年 8:00-17:00', 'openDateRuleInfo': [{'dateDesc': '全年', 'isCurrentTime': False, 'openWeekRuleInfo': [{'weekDesc': '8:00-17:00'}]}]}",南湖周围的环境很不错，景色宜人，还可以乘船欣赏两岸的风光。,{}
