名称,英文名,id,poiID,经度,维度,标签,特色,价格,最低价格,评价分数,评论数量,封面图片,成人票价格,老人票价格,学生票价格,儿童票价格,建议游玩,开放时间,介绍,优待政策杨枝寺,,133533176,133533176,23.189365,116.666471,,,0.0,0,4.5,9,https://dimg04.c-ctrip.com/images/01A5a1200099xt4tr05C3.jpg,0,0,0,0,1-2小时,"{'openStatus': '', 'openStatusType': 999, 'canSubscribed': False, 'hasSubscribed': False, 'likeCount': 0, 'isLiked': False, 'playSpendTime': '1-2小时'}",杨枝寺坐落于汕头海门龙头山，从高空俯瞰，山体宛若龙头！临海而建，海风清爽，十分舒适。,{}
丛熙公祠,Congxi Ancestral Hall,56731,85902,23.47195,116.646156,文化古迹|演出场馆,,0.0,0,3.8,23,https://youimg1.c-ctrip.com/target/01027120009eddvnaA4C3.jpg,0,0,0,0,1小时,"{'openStatus': '今日已闭园', 'openStatusType': 1, 'canSubscribed': False, 'hasSubscribed': False, 'openTimeTips': '具体营业状态以当天开放情况为准', 'likeCount': 0, 'isLiked': False, 'playSpendTime': '1小时', 'openTimeDesc': '全年 08:00-18:00；具体营业状态以当天开放情况为准', 'openDateRuleInfo': [{'dateDesc': '全年', 'isCurrentTime': False, 'openWeekRuleInfo': [{'weekDesc': '08:00-18:00'}]}]}", 从熙公祠在彩塘镇金砂管理区斜角头，为旅居马来西亚柔佛洲侨领陈旭年所建。兴工于清同治九年（1870），告竣于光绪九年（1884），历时十四年。从熙公祠座东向西，面宽31．22米，进深42.25米，为二进院落布局，前厅与后厅之间是天井，两侧有廊轩，后厅有抱厦，形成四厅相向的格局，后厅面宽三间，进深三间，斗拱抬架式木结构，地面铺大理石规格砖。琳琅满目的建筑装饰，使整座建筑物显得更加富丽堂皇，首进门楼前理分置精致石狮一对，门楼屋架为双面镂空石雕。而令人叹为观止的还是镶嵌于门楼石壁上的四幅石雕．这四幅石雕分别以渔樵耕读，花鸟虫鱼为题材，每幅石刻都很好地运用了“之”字形的构图，将不同时空的人、事、物集中在同一画面。祠内的潮州木雕也精美绝仑，首进的屋架，后座的抱厦和中槽屋架所有的梁枋、柱间诸穿、插构件都饰以玲戏剔透的潮州金漆木雕。,{}
黄岐山,Huangqi Xicui,141099,101670,23.581669,116.37159,文化古迹|演出场馆|登高爬山,登顶欣赏美丽的风景,0.0,0,4.5,78,https://dimg04.c-ctrip.com/images/100a19000001644s547A2.jpg,0,0,0,0,2-3小时,"{'openStatus': '开园中', 'openStatusType': 0, 'canSubscribed': False, 'hasSubscribed': False, 'likeCount': 0, 'isLiked': False, 'playSpendTime': '2-3小时', 'openTimeDesc': '全年 全天开放', 'openDateRuleInfo': [{'dateDesc': '全年', 'isCurrentTime': False, 'openWeekRuleInfo': [{'weekDesc': '全天开放'}]}]}",黄岐夕翠是揭阳古八景之一， 黄岐夕翠指的就是黄岐山森林公园，黄岐山森林公园位于揭阳市区北郊，黄岐山是揭阳历史文化名城的一个象征。近年，由于政府大力投入人力、物力、财力等，修建亭台庙宇，铺设石路，改造山貌，美化环境，以使其成为一远近闻名的旅游胜地。黄岐山森林公园地处榕城东北八里，主峰高近300米，总面积1180公顷，黄岐山上文物古迹众多，摩崖石刻奇秀。黄岐山山上有九庵十八岩，山顶还有个岐山塔，岐山塔始建于明代，高达20米呈八角形共五层。站在塔边俯瞰平原，方圆几十里之内的景物尽收眼底。山中还有月容墓、侣云寺、卧云洞等名胜古迹，有“海滨邹鲁”摩崖石刻等20多处，自然景观有宝塔远眺、石室访泉、古亭春色、侣云钟声、栖凤卧云、竺岗晚翠、上界晨光、百鸟朝凤等八景。揭阳古八景之“黄岐夕翠”，景色动人，让游客流连忘返。,{}
凤凰洲公园,Fenghuangzhou Park (Northwest Gate),56672,85878,23.650462,116.651424,文化古迹|演出场馆,有古式台榭建筑的公园,0.0,0,4.1,23,https://youimg1.c-ctrip.com/target/0100m120009d3jilw7124.jpg,0,0,0,0,1小时,"{'openStatus': '今日已闭园', 'openStatusType': 1, 'canSubscribed': False, 'hasSubscribed': False, 'likeCount': 0, 'isLiked': False, 'playSpendTime': '1小时', 'openTimeDesc': '全年 8:30-18:00', 'openDateRuleInfo': [{'dateDesc': '全年', 'isCurrentTime': False, 'openWeekRuleInfo': [{'weekDesc': '8:30-18:00'}]}]}",    凤凰洲公园位于潮州城南郊韩江大桥下沙洲头。园中的凤凰台由台体和亭阁两部分组成，是个古式台榭建筑。四柱，单檐结构的亭阁端立在高大的石砌台基上，檐牙高筑，峻凌飘逸，其上“凤台时雨”、“中流砥柱”、“有凤来仪”等牌匾与木质结构，明式拱斗和屋面的传统青瓦相映衬，文气斐然。自明朝建台之后，明清两代历代官吏和地方绅士先后在此倡建了“十相祠”、“凤台书院”、“文昌祠”、“龙神庙”、“天后宫”、“镇洪寺”、“鲁公祠”、“周公祠” 及“奎阁”等十多处景物，但这些景点因年代变迁，多数踪迹全无，唯有凤凰台、奎阁、天后宫等因风景绝妙及人文昌盛之标识，屡毁屡建。    　凤凰台原名老鸦洲，明末潮州知府曾多次游览沙洲，爱其清静幽雅，同时倍感潮州文风鼎盛，风物非凡，认为这里应是传说中凤凰栖宿之所，绝不是老鸦投林的地方，遂把原名的“老鸦洲”改为“凤凰洲”，并于明隆庆二年（1568年）在凤凰洲筑建一座十余丈高的石台，命名为“凤凰台”。自此，这里成为游人徘徊难离的名胜。潮州八景之凤凰时雨    凤凰时雨，古时又称“凤台侍雨”，也有人说是“凤台时雨”。    夏秋时节，这里清风习习，江风吹拂，暑气顿消，特别是乍晴乍雨的时节，江上奇景，千变万化，更为可观。帆影片片，湘子桥上烟雨蒙蒙。仰视笔架山巅轻云抒卷，雾锁楼阁。这令人神往的绝妙景致，便是“凤凰时雨”。九月九 风筝节    每年“九月九”是潮州的风筝节，各地的风筝都聚集在凤凰洲公园中竞相媲美，届时天空中风筝星星点点，实为一景。,{}
海天之间东亚风情沙滩,,112651929,112651929,23.410055,117.082165,海滨沙滩,,0.0,0,0.0,0,https://dimg04.c-ctrip.com/images/1me5o12000aoy9xaoA07A.jpg,0,0,0,0,,,,{}
龙虎滩旅游度假区,Longhu Beach Tourist Resort,69347019,69347019,23.224734,116.687993,海滨沙滩,,0.0,0,4.0,6,https://youimg1.c-ctrip.com/target/0100g12000as4s8r42BBB.jpg,0,0,0,0,2-3小时,"{'openStatus': '', 'openStatusType': 999, 'canSubscribed': False, 'hasSubscribed': False, 'likeCount': 0, 'isLiked': False, 'playSpendTime': '2-3小时', 'openTimeDesc': '具体营业状态以当天开放情况为准'}",龙虎滩位于汕头市河浦区，距市区27公里，是一个天然的海滨浴场。由于海岸线如卧滩老虎而得名。海滩水质清澈，沙白细柔，地势平缓又因海岸线外凸形成风大浪急，却是有惊无险的地带，是汕头一带较为刺激的海滨浴场之一，也是帆板运动的极佳海域，1999年被评为省级旅游度假区。,{}
百花山,Baihua Mountain,1829559,24648703,23.04973,116.400399,文化古迹|演出场馆|登高爬山,群峰挺拔、四季如春,0.0,0,3.6,22,https://youimg1.c-ctrip.com/target//100s1a0000019n8hr3E56.jpg,0,0,0,0,3-4小时,"{'openStatus': '', 'openStatusType': 999, 'canSubscribed': False, 'hasSubscribed': False, 'likeCount': 0, 'isLiked': False, 'playSpendTime': '3-4小时'}",百花山，又名百花尖、百花岩，在惠来县城东11公里处。此处群峰挺拔，四季如春，繁花似锦，其中百花峰冠出群峰，上有百花园及古百花岩遗址，传说唐高僧大颠曾在此修行。南侧山腰有庄严禅寺，建于清乾隆年间，近年修葺一新，寺周有百花灵泉、玉石水门、飞炉显圣、动摇石、试剑石等景点。流传民间的百花公主的动人传说，更为此山蒙上一层神奇色彩。,{}
吴平寨码头,Wupingzhai Wharf,5588445,67815151,23.476123,117.110329,,,0.0,0,0.0,0,https://youimg1.c-ctrip.com/target/1A07160000010pal73D66.jpg,0,0,0,0,1-3小时,"{'openStatus': '', 'openStatusType': 999, 'canSubscribed': False, 'hasSubscribed': False, 'likeCount': 0, 'isLiked': False, 'playSpendTime': '1-3小时', 'openTimeDesc': '开放时间：9:00-18;00 以潮汐为准'}",海上绿洲是深澳大海上餐厅，提供海鲜点餐，还有出海捕鱼（撒网或长城网）、罾网捕鱼（夜捕鱿鱼）、海上烧烤等。到吴平寨码头乘小木船到海上绿洲平台。随渔家出海，观赏这一片海上养殖区，包括海上渔村、生蚝扇贝龙须菜等。体验长城网捕鱼。行程约1小时。捕完鱼回到海上绿洲平台，船老大根据所捕渔获安排菜式，再适当增加其他海鲜，管饱！,{}
菩提禅寺,Puti Temple,69258116,69258116,23.2776,116.61307,,,0.0,0,3.3,7,https://dimg04.c-ctrip.com/images/0105k1200095xwp1288AB.png,0,0,0,0,,,,{}
虎丘山,Huqiu Mountain,90498399,90498399,23.526408,116.759391,登高爬山,,0.0,0,5.0,1,https://youimg1.c-ctrip.com/target/0103e12000as18wxx53A4.jpg,0,0,0,0,,,,{}
南澎列岛国家级自然保护区,Nanpeng Islands National Natural Reserve,69257116,69257116,23.256528,117.288117,地标观景,,0.0,0,0.0,0,https://youimg1.c-ctrip.com/target/0100212000asj1xtiB2E0.png,0,0,0,0,,,,{}
莱长渡口,Laichang Ferry,131147,93998,23.412293,116.863529,,,0.0,0,4.7,3,https://youimg1.c-ctrip.com/target/0104r120008hdq7ed8758.jpg,0,0,0,0,10-15分钟,"{'openStatus': '今日已闭园', 'openStatusType': 1, 'canSubscribed': False, 'hasSubscribed': False, 'likeCount': 0, 'isLiked': False, 'playSpendTime': '10-15分钟', 'openTimeDesc': '全年 09:00-15:00', 'openDateRuleInfo': [{'dateDesc': '全年', 'isCurrentTime': False, 'openWeekRuleInfo': [{'weekDesc': '09:00-15:00'}]}]}",汕头莱长渡口是坐船通往南澳岛的必经之渡口乘轮渡往返汕头澄海的莱芜渡口到南澳岛的大约半个小时，不过一小时才有一班船，20元往返，可以人和车一起上。 ,{}
汛洲岛,Xunzhou Island,2503828,36181028,23.573281,117.034667,游山玩水,岛上鸟类繁多,0.0,0,4.4,16,https://youimg1.c-ctrip.com/target/0102g1200085rquno423A.jpg,0,0,0,0,1-2天,"{'openStatus': '', 'openStatusType': 999, 'canSubscribed': False, 'hasSubscribed': False, 'likeCount': 0, 'isLiked': False, 'playSpendTime': '1-2天', 'openTimeDesc': '具体营业状态以当天开放情况为准'}",汛洲岛在广东省潮州市饶平县，古代为饶平汛地，所以称为汛洲。由于岛上居民大多数从事渔业，后来又改名为汛洲岛。 岛上有海湾沙滩，海底坡度平缓，砂质洁净，是非常不错的海滨浴场。岛上鸟类繁多，较闻名的就是白鹭。另外，汛洲岛岸边还有“三叠石”、“仙脚印”、“鲤鱼印”、“铜鼓石”三大景点。,{}
红头船公园,Hongtouchuan Park,1646882,18411639,23.451125,116.760724,演出场馆,以“红头船”巨型石雕闻名,0.0,0,4.1,64,https://youimg1.c-ctrip.com/target/01059120008g2lenj4B55.jpg,0,0,0,0,0.5-1小时,"{'openStatus': '开园中', 'openStatusType': 0, 'canSubscribed': False, 'hasSubscribed': False, 'likeCount': 0, 'isLiked': False, 'playSpendTime': '0.5-1小时', 'openTimeDesc': '全年 全天开放', 'openDateRuleInfo': [{'dateDesc': '全年', 'isCurrentTime': False, 'openWeekRuleInfo': [{'weekDesc': '全天开放'}]}]}","澄海红头船公园位于韩江支流外砂河北岸，占地面积304公顷。公园于1999年2月开工建设，2002年竣工，投入建设资金2000多万元。红头船公园展示的""团结拼搏拓展创新""的潮汕人精神。园中“红头船”巨型石雕出自潮籍著名雕塑家唐大禧之手。整座红头船雕塑由平台和船体两部分组成，船体底部长408米宽10米。巍峨的船头高达13米，高耸的桅杆长28米，红头船雕塑的船脸采用四川的“中国红”石雕成，炯炯有神的船眼用黑色灰岗岩制作，船额上刻“海不扬波”及“顺风得利”8个贴金大字。游人可沿石级登上“甲板”，眺望远处，韩江三角洲秀美风光尽收眼底。澄海是红头船的故乡昔年潮汕人曾乘坐红头船远渡重洋到海外谋生在陌生的国度繁衍生息艰苦创业开创繁荣局面。如今红头船已成为海内外经济文化交流的象征。",{}
汕头东山湖,Shantou Dongshan Lake,1833353,24652561,23.507001,116.586366,游山玩水,建有矿泉疗养院,0.0,0,4.1,12,https://youimg1.c-ctrip.com/target/0104k1200092lya039A48.jpg,0,0,0,0,1-2小时,"{'openStatus': '', 'openStatusType': 999, 'canSubscribed': False, 'hasSubscribed': False, 'likeCount': 0, 'isLiked': False, 'playSpendTime': '1-2小时', 'openTimeDesc': '具体营业状态以当天开放情况为准。'}",位于广东省汕头市潮阳区潮阳区的东山湖，距市区20多公里，有公共汽车往返，出行很方便。在这有日夜沸腾的温泉，建有矿泉疗养院。东山湖周围段群山上，还有不少古墓葬，其中有明代状元大钦的亭式墓冢和石刻多处。湖光山色，古墓新景，相映生趣。,{}
颐园,Yiyuan Garden,131447,94023,23.662198,116.651744,演出场馆,走进颐园领略大师风采,0.0,0,4.0,11,https://dimg04.c-ctrip.com/images/0104k120008ii0ms339E3.jpg,0,0,0,0,1-3小时,"{'openStatus': '今日已闭园', 'openStatusType': 1, 'canSubscribed': False, 'hasSubscribed': False, 'likeCount': 0, 'isLiked': False, 'playSpendTime': '1-3小时', 'openTimeDesc': '全年 周二-周日 9:00-17:00', 'openDateRuleInfo': [{'dateDesc': '全年', 'isCurrentTime': False, 'openWeekRuleInfo': [{'weekTime': '周二至周日', 'weekDesc': '9:00-17:00'}]}]}",位于古城城脚下水门内的饶宗颐学术馆，又名颐园，是展示国际汉学大师饶宗颐教授成长历程、学术成就、艺术造诣及对外学术交流的重要基地。近日，借湘桥区中小学生开展“走进颐园·领略大师风采”活动之机，再次走进颐园，细细品读，感受饶先生奇异的学术灵气和丰赡的学术成就。,{}
大桑浦山,Sangpu Mountain,50158,83071,23.467679,116.584125,登高爬山,以盛产桑树而得名,0.0,0,4.2,27,https://youimg1.c-ctrip.com/target/01034120009ctgkmcB1D4.jpg,0,0,0,0,3-4小时,"{'openStatus': '', 'openStatusType': 999, 'canSubscribed': False, 'hasSubscribed': False, 'likeCount': 0, 'isLiked': False, 'playSpendTime': '3-4小时'}",桑浦山风景区位于潮州城西南约20公里处。山高600余米，周围约27公里，以曾盛产桑树而得名。其山怪石嶙峋，林木繁茂，遍布巨石悬复的岩洞和千姿百态的石林。著名景观有以700平方米巨石为天然上盖的古刹甘露寺；有中离洞、李姑洞等；有展示古海蚀地貌的海蚀蘑菇状石林，还有潮州名贤林大钦及其岳母的陵墓等。山之南麓立有新建的北回归线标志塔。山之东麓有东山湖，三面环山，分大小西湖，湖滨散布丰富的温泉和矿泉资源。,{}
巨峰寺,Jufeng Temple,1510836,18160468,23.302849,116.708255,,藏于茂密深山中的殿宇楼阁,0.0,0,4.2,56,https://youimg1.c-ctrip.com/target/0102w120008k16v2t17AF.jpg,0,0,0,0,1-2小时,"{'openStatus': '今日已闭园', 'openStatusType': 1, 'canSubscribed': False, 'hasSubscribed': False, 'openTimeTips': '具体营业状态以当天开放情况为准。', 'likeCount': 0, 'isLiked': False, 'playSpendTime': '1-2小时', 'openTimeDesc': '全年 08:00-17:00（16:30停止入园）；具体营业状态以当天开放情况为准。', 'openDateRuleInfo': [{'dateDesc': '全年', 'isCurrentTime': False, 'openWeekRuleInfo': [{'weekDesc': '08:00-17:00(最晚入园16:30)'}]}]}",巨峰寺是一个集旅游观光、建筑欣赏、宗教参拜于一体的游览胜地。古庙藏于茂密的深山中，景色幽深、风景秀丽，适合隐居和修身养性。寺内殿宇楼阁，成群排列，格局整齐一致，装饰得金碧辉煌。寺内的岩石壁画、名家墨宝也琳琅满目，具有很高的艺术欣赏价值。,{}
桂园,Guiyuan Garden,3785583,39607022,23.356447,116.68372,文化古迹,百年红砖楼别墅,0.0,0,4.4,6,https://dimg04.c-ctrip.com/images/100u1a0000019i16821CA.jpg,0,0,0,0,1-2小时,"{'openStatus': '今日已闭园', 'openStatusType': 1, 'canSubscribed': False, 'hasSubscribed': False, 'likeCount': 0, 'isLiked': False, 'playSpendTime': '1-2小时', 'openTimeDesc': '全年 周二-周日 09:00-17:00', 'openDateRuleInfo': [{'dateDesc': '全年', 'isCurrentTime': False, 'openWeekRuleInfo': [{'weekTime': '周二至周日', 'weekDesc': '09:00-17:00'}]}]}",桂园原名为“林桂馥堂”，是汕头一处极具历史研究价值的革命旧址。也是一座典型的红砖楼别墅。,{}
灵山寺,The Lingshan Temple,131145,93996,23.322139,116.441399,,素有“道迹贤踪”的美誉,0.0,0,4.3,41,https://youimg1.c-ctrip.com/target/100b0e0000006z03j4160.jpg,0,0,0,0,1-2小时,"{'openStatus': '今日已闭园', 'openStatusType': 1, 'canSubscribed': False, 'hasSubscribed': False, 'likeCount': 0, 'isLiked': False, 'playSpendTime': '1-2小时', 'openTimeDesc': '全年 4:00-16:00', 'openDateRuleInfo': [{'dateDesc': '全年', 'isCurrentTime': False, 'openWeekRuleInfo': [{'weekDesc': '4:00-16:00'}]}]}","汕头灵山寺位于广东汕头市潮阳铜盂龙山湾,素有“道迹贤踪”的美誉。 寺院保留当时的结构与规模，占地约5000平方米，为土木结构，分三厅六院九天井，东楼西阎，房40间；前为观音殿，中是大雄宝殿，后是二层的大颠堂及藏经楼。寺前一泓湖水，波光粼粼，背靠青山，分外宜人。",{}
海关关史陈列馆,Shantou Haiguan Guanshi Exhibition Hall,1646852,18411601,23.349854,116.674747,演出场馆,了解汕头海关的发展历程,0.0,0,4.6,18,https://youimg1.c-ctrip.com/target/10021a0000019p53e96C0.jpg,0,0,0,0,1-2小时,"{'openStatus': '暂停营业', 'openStatusType': 4, 'openTime': '营业时间待定', 'canSubscribed': False, 'hasSubscribed': False, 'openTimeTips': '具体营业状态以当天开放情况为准。', 'likeCount': 0, 'isLiked': False, 'playSpendTime': '1-2小时', 'openTimeDesc': '全年 周三,周六 09:00-11:30,15:00-17:00（16:30停止入园） 周一-周二,周四-周五,周日；具体营业状态以当天开放情况为准。', 'openDateRuleInfo': [{'dateDesc': '全年', 'isCurrentTime': False, 'openWeekRuleInfo': [{'weekTime': '周三,周六', 'weekDesc': '09:00-11:30,15:00-17:00(最晚入园16:30)'}, {'weekTime': '周一至周二,周四至周五,周日', 'weekDesc': '不开放'}]}]}",海关钟楼位于广东省汕头市金平区海安街道怀安居委外马路2号，即潮海关办公楼，现为汕头海关关史陈列馆。整栋大楼分为上下两层，长方体结构，两侧的开放式走廊以及顶部160个用于装饰的米字窗环绕大楼四周，属于欧式新古典建筑风格，建筑面积1556.2平方米。办公楼正门上方区域使用了大理石进行装饰，顶端雕刻有雄狮头像，显得庄严肃穆，正中央则镶嵌一面以罗马数字作为标识的大钟，海关钟楼也由此而得名。海关钟楼的钟声曾经是解放前汕头市的“标准时间”，伴随着老一辈汕头人的成长。整个陈列馆分为楼上和楼下两个展区。楼下展示的是潮汕地区海关的历史沿革，楼上展示的是解放后汕头海关的发展变化。,{}
市外桃园旅游区（原宝山湖）,City Taoyuan Tourist Resort (former Baoshan Lake),4381372,50947421,23.660399,116.458021,度假村|3A|体验慢生活,自然山水融合潮汕文化,0.0,0,4.4,303,https://youimg1.c-ctrip.com/target/10011f000001h355907E0.jpg,48.0,35.0,48.0,0,0.5-1天,"{'openStatus': '今日已闭园', 'openStatusType': 1, 'canSubscribed': False, 'hasSubscribed': False, 'likeCount': 0, 'isLiked': False, 'playSpendTime': '0.5-1天', 'openTimeDesc': '全年 08:30-17:30', 'openDateRuleInfo': [{'dateDesc': '全年', 'isCurrentTime': False, 'openWeekRuleInfo': [{'weekDesc': '08:30-17:30'}]}]}",市外桃园旅游区（原宝山湖）位于揭阳市揭东区云路镇，是以深厚的潮汕文化为依托，集自然观光、休闲度假、商务接待、文化体验及健康养老等功能于一体的山地生态旅游度假新地标。景区内有入山关楼、复古亭、分水服务点、岁寒居、清音阁、仙林场服务点（绿翠阁）、恐龙谷、浮桥和吊桥等。,"{'儿童': [['1.2米（不含）以下儿童免票', '免费']], '老人': [['70周岁（含）以上长者凭有效证件免票', '免费']], '优待人群': [['1.2米（含）-1.4米（含）儿童，60周岁（含）至69周岁（含）长者凭有效身份证', '优待票']]}"
饶宗颐学术馆,Jao Tsung-I Petite Ecole Chaozhou,1714936,22867422,23.662102,116.65178,文化古迹,,0.0,0,4.7,29,https://youimg1.c-ctrip.com/target/100o0z000000nceedF4CD.jpg,0,0,0,0,1-2小时,"{'openStatus': '今日已闭园', 'openStatusType': 1, 'canSubscribed': False, 'hasSubscribed': False, 'openTimeTips': '具体营业状态以当天开放情况为准', 'likeCount': 0, 'isLiked': False, 'playSpendTime': '1-2小时', 'openTimeDesc': '全年 周一 周二-周日 09:00-17:00；具体营业状态以当天开放情况为准', 'openDateRuleInfo': [{'dateDesc': '全年', 'isCurrentTime': False, 'openWeekRuleInfo': [{'weekTime': '周一', 'weekDesc': '不开放'}, {'weekTime': '周二至周日', 'weekDesc': '09:00-17:00'}]}]}",饶宗颐学术馆位于潮州古城区的下水门城脚，该馆建于1993年11月，是一个潮籍名人学术馆。该馆占地面积450多平方米，建筑面积700平方米。,{}
凤翔峡原始生态旅游区,Fengxiangxia Original Ecological Tourist Area,131445,94021,23.820886,116.711117,游山玩水|亲近大自然,山谷险峻，飞瀑成群,0.0,0,3.6,86,https://dimg04.c-ctrip.com/images/350p16000000zchc5BDBE.jpg,0,0,0,0,2-3小时,"{'openStatus': '今日已闭园', 'openStatusType': 1, 'canSubscribed': False, 'hasSubscribed': False, 'likeCount': 0, 'isLiked': False, 'playSpendTime': '2-3小时', 'openTimeDesc': '全年 08:30-16:30（16:00停止入园）', 'openDateRuleInfo': [{'dateDesc': '全年', 'isCurrentTime': False, 'openWeekRuleInfo': [{'weekDesc': '08:30-16:30(最晚入园16:00)'}]}]}",凤翔峡位于粤东第一山——凤凰山山脉东南翼，紧靠凤凰山脉第三峰——番岽山（1036m），也是凤凰山的南大门。雄丽多姿的凤凰山脉逶迤起伏，峰回路转到了大山地界，大山有一个凤湖村，背靠主峰1391米的高山，村前两座林木叠翠的青山中间形成了一条曲曲弯弯的峡谷，山谷险峻陡立，清泉如玉喷珠，这就是风景独特的凤翔峡。景区从山下的山门进去，一步一步向上攀登才能到达凤湖村前的玉湖休闲区。进山门，过岩隙，踩着盘山新开出来铺着鹅卵石的水泥小道，景区在陡峭的小道悬崖边架设一条长长的金属护栏，游人借助护栏一边欣赏清新旷远的峡谷，又可采抽几张好照片。凤翔峡保留着原生态之美，山谷间的吊桥、凉亭也是朴素无华。两边山坡绿荫如盖，绿的碧绿，蓝的翠蓝，在阳光照耀下，呈现出斑斓的色彩。峡谷间乱石纵横，奇岩兀立，泉水喷涌，银珠飞瀑，水潭幽深。顺着卵石小道愈往上行，山势愈险，许事地方是陡立的峭壁，上了年纪的人要走完全程很不容易。凤翔峡集凤凰山脉峡谷壮秀景色于一身，也是凤凰山脉中较具代表性的峡谷瀑布群。“扶阴听瀑”、“晶廉溅玉”、“苍龙饮峡”、“银河落汉”等瀑布组成了凤凰山脉独特的自然生态水系瀑布群。,"{'儿童': [['1.0米（不含）以下', '免费']]}"
汕头礐石大桥,Shantou Queshi Bridge,50156,83069,23.337487,116.66477,地标观景,PC梁混合梁的结构,0.0,0,4.5,28,https://youimg1.c-ctrip.com/target/100l10000000paxs34A75.jpg,0,0,0,0,10-20分钟,"{'openStatus': '', 'openStatusType': 999, 'canSubscribed': False, 'hasSubscribed': False, 'likeCount': 0, 'isLiked': False, 'playSpendTime': '10-20分钟'}",大桥位于广东省汕头市区西部，南起国道324广汕公路，跨越汕头海港，北与国道206线联接，是继汕头市市区东部建成的海湾大桥后动工兴建的第二座特大型跨海大桥，总概算人民币12.5亿，大桥正桥全长2865米，全桥包括互通立交，引桥匝道、引道总延长米为5976米。全桥六车道，两侧加设人行观光道，桥面总宽30.5米。主塔塔身高148米，主桥主跨518米，通航净高38米，可通航2万吨级船舶。大桥主桥钢绞线斜拉索和钢箱梁与PC梁混合梁的结构，为我国首例，技术先进，气势磅礴，大桥于1998年12月建成。礐石大桥的建成将与海湾大桥形成跨海交通环线，对推动和改善汕头市投资环境和发展经济起到重大的作用。,{}
屏山岩,Pingshan Rock,1714820,22867461,23.452778,117.090263,文化古迹|登高爬山,登高眺望海岛美景,0.0,0,4.0,2,https://dimg04.c-ctrip.com/images/0103412000axebsyx98A6.jpg,0,0,0,0,1-3小时,"{'openStatus': '', 'openStatusType': 999, 'canSubscribed': False, 'hasSubscribed': False, 'likeCount': 0, 'isLiked': False, 'playSpendTime': '1-3小时'}",屏山岩有一副对联：“屏山峭立西天岭，岩寺凭依南岛峰”。这是清末邑人张殿光所撰。又有一副对联曰：“屏藩毓秀围青嶂，山水钟灵涌壁岩”。这是上海圆明讲堂圆英法师所撰。两幅对联概括了屏山岩险要的位置、雄伟的气势和壮丽的风光。,{}
