名称,英文名,id,poiID,经度,维度,标签,特色,价格,最低价格,评价分数,评论数量,封面图片,成人票价格,老人票价格,学生票价格,儿童票价格,建议游玩,开放时间,介绍,优待政策东源县博物馆,Dongyuanxian Museum,5703848,79437482,23.782328,114.747309,博物馆|演出场馆,,0.0,0,0.0,0,https://youimg1.c-ctrip.com/target/0104t120009418fu55567.jpg,0,0,0,0,2-3小时,"{'openStatus': '今日已闭园', 'openStatusType': 1, 'canSubscribed': False, 'hasSubscribed': False, 'likeCount': 0, 'isLiked': False, 'playSpendTime': '2-3小时', 'openTimeDesc': '全年 09:00-17:00', 'openDateRuleInfo': [{'dateDesc': '全年', 'isCurrentTime': False, 'openWeekRuleInfo': [{'weekDesc': '09:00-17:00'}]}]}",东源县博物馆，位于广东省，博物馆内部有丰富的藏品，珍贵文物，还有展览活动，参观人数众多。,{}
河源市科技馆,HeYuanShi KeJiGuan,4511264,50647079,23.757578,114.698897,科技馆,,0.0,0,4.8,6,https://youimg1.c-ctrip.com/target/0104f12000a6rawwmBD81.jpg,0,0,0,0,2-3小时,"{'openStatus': '今日已闭园', 'openStatusType': 1, 'canSubscribed': False, 'hasSubscribed': False, 'openTimeTips': '具体营业状态以当天开放情况为准', 'likeCount': 0, 'isLiked': False, 'playSpendTime': '2-3小时', 'openTimeDesc': '全年 周二-周日 09:00-12:00,15:00-17:00 周一；具体营业状态以当天开放情况为准', 'openDateRuleInfo': [{'dateDesc': '全年', 'isCurrentTime': False, 'openWeekRuleInfo': [{'weekTime': '周二至周日', 'weekDesc': '09:00-12:00,15:00-17:00'}, {'weekTime': '周一', 'weekDesc': '不开放'}]}]}",河源市科技馆交通便利，是亲子同乐，了解新知识的好地方。,{}
紫金县云岩寺,Zijinxian Yunyan Temple,4581202,51653562,23.414294,115.390204,演出场馆|文化古迹,,0.0,0,5.0,1,https://dimg04.c-ctrip.com/images/0106a120008fgnwz4A64F.jpg,0,0,0,0,1-2小时,"{'openStatus': '', 'openStatusType': 999, 'canSubscribed': False, 'hasSubscribed': False, 'likeCount': 0, 'isLiked': False, 'playSpendTime': '1-2小时', 'openTimeDesc': '具体营业状态以当天开放情况为准'}",紫金县云岩寺始建于清朝初年，至今已有300多年历史，寺中天然的莲花石座上供奉着大慈大悲、救苦救难的观世音菩萨，一直以来信众众多，香火不断。,{}
惠州盛花谷,Shenghuagu,5719982,132066806,23.580639,114.243022,游山玩水,,0.0,0,4.6,17,https://dimg04.c-ctrip.com/images/0106r1200099etmic046A.jpg,23.0,23.0,23.0,23.0,,"{'openStatus': '开园中', 'openStatusType': 0, 'canSubscribed': False, 'hasSubscribed': False, 'openTimeTips': '大型活动营业时间以公示为主', 'likeCount': 0, 'isLiked': False, 'openTimeDesc': '全年 09:00-21:00（18:00停止售票）；大型活动营业时间以公示为主', 'openDateRuleInfo': [{'dateDesc': '全年', 'isCurrentTime': False, 'openWeekRuleInfo': [{'weekDesc': '09:00-21:00(停止售票18:00)'}]}]}",龙门盛花谷景区，盛花谷景区位于惠州市门县龙华镇青年林场内，是省级休闲农业与乡村旅游示范点，占地面积5200亩，拥有丰富的天然森林资源。园区内有超过200亩的黄花风铃木，花蕊盛开季节超级壮观，每年吸引几十万摄影爱好者前来打卡。盛花谷是结合客家文化特色，打造集餐饮、住宿、观光、农业科普为一体的生态度假村。一、农业观光区：园内有玫瑰园、农业科普长廊、蔬果采摘（蔬菜、圣女果）、山茶花迷宫、萌萌场景打卡、古老许愿井、河道游船等150亩花卉网红打卡功能区；二、网红打卡区：200亩黄花风铃木、彩虹道、网红鸟巢、秋千木栈道、相框打卡、绿野仙踪木栈道；三、奇妙小火车：每个人的心里，都有一辆开往童年的小火车，乘坐奇妙小火车开启一场丛林穿越之旅。（自费）四、垂钓区：可携带鱼竿，在静谧的湖畔休闲垂钓彻底放松身心，忘却城市的喧嚣，来一场身与心的陶冶。（自费）五、餐饮区：园区内备有木屋水上餐厅、中餐宴会厅、环湖烧烤场、美食小吃街、胡子叔叔手信店。六、草坪星空露营：5600平方米大草坪星空露营，拥有20顶天幕帐篷，您可以坐在天幕下品尝小资下午茶点，夜晚进行BBQ自助晚餐，躺在草坪中仰望星空，进行草坪LIVE音乐篝火晚会，一起把酒欢歌，回味青春年少。（20人以上可安排音乐晚会）七、泰极汤泉度假酒店：酒店拥有汤泉客房16间（双人房 9 间 、大床房 6 间、亲子房1间），将森林景观与现代空间艺术完美结合，营造出时尚、健康、极致尊贵的休息环境，配合华丽柔软的灯光，更是美不胜收，令人流连忘返。房间内还配备了阳台，微风吹来坐上藤制摇椅微微晃动尽情享受午后的宁静与安逸到了夜晚在这里聊天看星星不失为一个好主意~,{}
镜花缘生态旅游度假风景区,Jinghuayuan Ecological Tourism Vacation Scenic Area,5068531,56807209,23.776159,114.629277,度假村,,0.0,0,0.0,0,https://youimg1.c-ctrip.com/target/0104212000a5cjroi13F0.jpg,0,0,0,0,1-2天,"{'openStatus': '今日已闭园', 'openStatusType': 1, 'canSubscribed': False, 'hasSubscribed': False, 'openTimeTips': '具体营业状态以当天开放情况为准', 'likeCount': 0, 'isLiked': False, 'playSpendTime': '1-2天', 'openTimeDesc': '全年 08:30-17:00；具体营业状态以当天开放情况为准', 'openDateRuleInfo': [{'dateDesc': '全年', 'isCurrentTime': False, 'openWeekRuleInfo': [{'weekDesc': '08:30-17:00'}]}]}",整个镜花缘风景区都是围绕万绿湖这片水而设计的。景区风景如画，气候宜人，宛如世外桃源般的存在。是休闲、度假、观景的胜地。,{}
花仟谷欢乐田园(巴伐利亚店),,140777011,140777011,23.62439,114.623255,游乐场,,0.0,0,0.0,0,https://dimg04.c-ctrip.com/images/1lo3s12000bnjyhko7F95.jpg,72.4,72.4,72.4,72.4,,"{'openStatus': '开园中', 'openStatusType': 0, 'canSubscribed': False, 'hasSubscribed': False, 'likeCount': 0, 'isLiked': False, 'openTimeDesc': '全年 10:00-21:00', 'openDateRuleInfo': [{'dateDesc': '全年', 'isCurrentTime': False, 'openWeekRuleInfo': [{'weekDesc': '10:00-21:00'}]}]}",巴伐利亚花仟谷欢乐田园是庄园里最热门的网红打卡地，很多女孩子都拿着相机拍照，它是集无动力、花海、研学为一体的欢乐田园，集中了30多种无动力设备，通过体能拓展训练器材来锻炼儿童的身体素质，也提供了一个放松身心的环境，使家庭成员更加紧密地联系在一起，切实体验到亲情作为一种亲子主题田园，无动力体能拓展训练器材种类多样，可以满足儿童不同年龄的需求，为游玩提供更多的选择。田园里色彩绚丽的鲜花尽情的绽放。是一个绝美的拍照打卡地。是溜娃的好去处，也是享受亲子休闲时光好地方。 ,{}
铁泉·黄金汤原生态旅游度假区,Tiequan Huangjintang Ecological Resort,50996,83548,23.819391,114.238994,度假村|体验慢生活|4A,出口多流量大的黄金汤,0.0,0,4.3,546,https://youimg1.c-ctrip.com/target/1A0c11000000rbr388EB4.jpg,103.0,103.0,103.0,55.0,1天,"{'openStatus': '今日已闭园', 'openStatusType': 1, 'canSubscribed': False, 'hasSubscribed': False, 'openTimeTips': '温泉开放时间09:30-18:00；水上乐园 每年11月至4月暂停开放部分设施，冷水区开放时间09:00-18:00  （景区官网）', 'likeCount': 0, 'isLiked': False, 'playSpendTime': '1天', 'openTimeDesc': '全年 09:00-18:00（17:00停止入园）；温泉开放时间09:30-18:00；水上乐园 每年11月至4月暂停开放部分设施，冷水区开放时间09:00-18:00  （景区官网）', 'openDateRuleInfo': [{'dateDesc': '全年', 'isCurrentTime': False, 'openWeekRuleInfo': [{'weekDesc': '09:00-18:00(最晚入园17:00)'}]}]}",惠州龙门铁泉龙门铁泉温泉位于广东省惠州市龙门县龙田镇，集温泉、森林度假、商务会议为一体。铁泉旅游度假区拥有“三大两独”特色：世界范围的温泉康乐中心、全国范围的山水园林温泉、全国独有的天然黄金蒸汽浴、全国独有的珍稀黄金汤泉、温泉仿海浪冲浪。铁泉大温泉拥有丰富的温矿泉水资源，温泉水温高达78摄氏度，富含丰富的铁、锍、氡、钙、镁等48种矿物质元素，因温泉水含铁量较多，水质金黄，故称为“黄金汤”。泉水出口多、流量大，故称为“铁泉大温泉”，不亚于日本世界著名“黄金汤泉”。度假区设施配套齐全，目前拥有各类特色客房及别墅客房600间，可同时容纳2000人用餐的宴会厅，茶艺廊、特产超市、精品屋、桌球室、乒乓球室、羽毛球场等配套设施一应俱全。,"{'儿童': [['1.2米（不含）以下', '免费'], ['1.2米（含）－1.5米（不含）', '优惠']]}"
桃花水母大剧院,Taohua Shuimu Da Theater,1787308,23830563,23.771463,114.717803,话剧歌剧|演出场馆|地标观景,可举办各类文艺活动,0.0,0,4.8,22,https://youimg1.c-ctrip.com/target/10031f000001grzvo0F40.jpg,0,0,0,0,1-2小时,"{'openStatus': '今日已闭园', 'openStatusType': 1, 'canSubscribed': False, 'hasSubscribed': False, 'openTimeTips': '有演出时根据演出时间营业时间随时调整，具体营业状态以当天开放情况为准。', 'likeCount': 0, 'isLiked': False, 'playSpendTime': '1-2小时', 'openTimeDesc': '全年 10:00-18:00；有演出时根据演出时间营业时间随时调整，具体营业状态以当天开放情况为准。', 'openDateRuleInfo': [{'dateDesc': '全年', 'isCurrentTime': False, 'openWeekRuleInfo': [{'weekDesc': '10:00-18:00'}]}]}",桃花水母大剧院，是广东坚基集团投资2亿余元建设的功能齐全、设备先进，外观酷似万绿湖中“桃花水母 ”的国家甲等标准大剧院。大剧院位于河源市商业中心越王广场，占地面积约6200㎡，建筑面积约16000㎡，座位约1200个。剧院将充分利用高科技的声、光等舞美设计和手段，让观众体验一场美轮美奂的视听盛宴。作为粤东北地区首个大型专业剧院，这里将上演《桃花水母》等文化旅游系列剧目，成为承接中外艺术团体商业演出的文化高地。桃花水母大剧院是河源标志性旅游文化建筑，是河源市民欣赏各类演出、陶冶情操的艺术殿堂。,{}
镜花缘开心乐园,,140787776,140787776,23.776159,114.629277,游乐场,,0.0,0,0.0,0,https://dimg04.c-ctrip.com/images/1lo3612000bqg08o77A3A.jpg,0,0,0,0,,"{'openStatus': '今日已闭园', 'openStatusType': 1, 'canSubscribed': False, 'hasSubscribed': False, 'likeCount': 0, 'isLiked': False, 'openTimeDesc': '全年 09:30-18:00', 'openDateRuleInfo': [{'dateDesc': '全年', 'isCurrentTime': False, 'openWeekRuleInfo': [{'weekDesc': '09:30-18:00'}]}]}",镜花缘开心乐园位于河源万绿湖镜花缘内，地理位置优越，园区设多人秋千、冲天小摆锤、精灵小滚筒、海盗船、七彩滑梯、快乐沙池、森林高空魔网、丛林攀爬等等游乐项目,{}
东江源国际旅游度假区展示中心,Dongyuan Exhibition Hall,69264470,69264470,23.851552,114.798369,,,0.0,0,0.0,0,https://dimg04.c-ctrip.com/images/fd/tg/g2/M02/C5/09/Cghzf1W7IBCAU1soAAA1rXNRb5g042.jpg,0,0,0,0,,,,{}
雷公峡生态旅游区,Xiangtoushan Leigong Xiapiaoliu,70366,10795313,23.331615,114.439827,游山玩水|清凉漂流,激情穿越、仙境畅游,0.0,0,4.5,179,https://dimg04.c-ctrip.com/images/35070v000000k3js90C3B.jpg,138.0,138.0,138.0,138.0,2-3小时,"{'openStatus': '今日已闭园', 'openStatusType': 1, 'canSubscribed': False, 'hasSubscribed': False, 'openTimeTips': '漂流开放时间：13:00-14:30，14:30结束当日营业\n10月底-次年4月初景区暂时停业，出发前向景区确认营业时间(恶劣天气将停漂)', 'likeCount': 0, 'isLiked': False, 'playSpendTime': '2-3小时', 'openTimeDesc': '1月1日-12月31日 08:30-18:00；漂流开放时间：13:00-14:30，14:30结束当日营业\n10月底-次年4月初景区暂时停业，出发前向景区确认营业时间(恶劣天气将停漂)', 'openDateRuleInfo': [{'dateDesc': '1月1日-12月31日', 'isCurrentTime': False, 'openWeekRuleInfo': [{'weekDesc': '08:30-18:00'}]}]}",雷公峡漂流景区位于博罗泰美镇—著名的惠州市象头森林公园内，于2006年经广东省政府批准成立，成立之初就确立了以“开发具有当地特色的原生态旅游景区”为经营目标，共投资2500万元全力打造集休闲、旅游、度假、娱乐、观光于一体的大型综合生态旅游区（惠州雷公峡漂流景区）。景区交通便利，全程高速连接广州、东莞、惠州、深圳、河源、汕头等市。象头山雷公峡漂流全程长约4.5公里，漂流时间约2小时，由专业的建筑公司设计、施工的漂流河道落差近100米，河道大小落差十多处；峡谷入口有一座容量 达300万立方的中小型水库。河道水质好，水量充足时而奔腾直下、激流澎湃，时而回旋幽谷、心旷神怡。漂流河道途经20多个自然景观。沿途十里竹廊扶风相掩，高含量的负离子幽谷空气清新，清澈的溪水散发着自然灵气，让人置身于仙境一般，将让您领略“激情穿越、仙境畅游”的独特神韵。旅游区内配套设施齐全，设有激情漂流、农家中餐、豪华客房、野营、无公害菜园、优质果林、山谷攀爬、拓展培训基地、野狼野战基地、烧烤场、游泳池、钓鱼池、特色土特产购物等休闲、娱乐的服务项目。,{}
逸境温泉,,5718088,130873047,23.767358,114.718257,,,0.0,0,5.0,2,https://dimg04.c-ctrip.com/images/0101612000924kw2zB41D.jpg,0,0,0,0,0.5-1天,"{'openStatus': '开园中', 'openStatusType': 0, 'canSubscribed': False, 'hasSubscribed': False, 'likeCount': 0, 'isLiked': False, 'playSpendTime': '0.5-1天', 'openTimeDesc': '全年 14:00-23:00', 'openDateRuleInfo': [{'dateDesc': '全年', 'isCurrentTime': False, 'openWeekRuleInfo': [{'weekDesc': '14:00-23:00'}]}]}",,{}
河源越王井,King Yue Well of Heyuan,5136305,58280144,23.627903,114.631355,演出场馆|文化古迹,,0.0,0,0.0,0,https://youimg1.c-ctrip.com/target/0101k1200097chjta4E44.png,0,0,0,0,,"{'openStatus': '今日已闭园', 'openStatusType': 1, 'canSubscribed': False, 'hasSubscribed': False, 'likeCount': 0, 'isLiked': False, 'openTimeDesc': '全年 9:00-17:00', 'openDateRuleInfo': [{'dateDesc': '全年', 'isCurrentTime': False, 'openWeekRuleInfo': [{'weekDesc': '9:00-17:00'}]}]}",,{}
万绿湖客家风情街,WanLvHu KeJia FengQing Jie,5168942,58308793,23.775404,114.63284,街区漫步,,0.0,0,5.0,2,https://youimg1.c-ctrip.com/target/01A5c1200089gg2z6B3E1.jpg,0,0,0,0,2-3小时,"{'openStatus': '', 'openStatusType': 999, 'canSubscribed': False, 'hasSubscribed': False, 'likeCount': 0, 'isLiked': False, 'playSpendTime': '2-3小时', 'openTimeDesc': '具体营业状态以当天开放情况为准'}",万绿湖客家风情街依托秀美的山水风光、客家文化等多方面资源优势，打造了一处多功能特色街区，是河源展示给外界乃至世界的一个窗口。,{}
茶山公园,,124908053,124908053,23.744845,114.69747,演出场馆,,0.0,0,0.0,0,https://dimg04.c-ctrip.com/images/010091200090g0vwq2D3E.jpg,0,0,0,0,,"{'openStatus': '开园中', 'openStatusType': 0, 'canSubscribed': False, 'hasSubscribed': False, 'likeCount': 0, 'isLiked': False, 'openTimeDesc': '全年 全天开放', 'openDateRuleInfo': [{'dateDesc': '全年', 'isCurrentTime': False, 'openWeekRuleInfo': [{'weekDesc': '全天开放'}]}]}",茶山公园以电视发射塔为中心，分成东西两部分，公园内有广场区、老人休闲区、儿童活动区、山林区，景色非常美。,{}
五色茶岭景区,,126934507,126934507,24.144255,115.308495,儿童乐园,,0.0,0,0.0,0,https://youimg1.c-ctrip.com/target/0102e120009ar4vx7E57E.png,0,0,0,0,,"{'openStatus': '今日已闭园', 'openStatusType': 1, 'canSubscribed': False, 'hasSubscribed': False, 'likeCount': 0, 'isLiked': False, 'openTimeDesc': '全年 09:00-18:00（17:00停止入园）', 'openDateRuleInfo': [{'dateDesc': '全年', 'isCurrentTime': False, 'openWeekRuleInfo': [{'weekDesc': '09:00-18:00(最晚入园17:00)'}]}]}",,{}
清华园艺术馆,Qinghuayuan Art Museum,3478662,39297301,23.768155,114.690245,,,0.0,0,0.0,0,https://dimg04.c-ctrip.com/images/fd/tg/g1/M06/FC/25/CghzflW7IA-AKV6TAABByEo2c7Y435.jpg,0,0,0,0,,,,{}
宫保第遗址,Gongbaodi Ruins,4587505,51654115,24.370871,114.490822,演出场馆|文化古迹,,0.0,0,4.0,1,https://youimg1.c-ctrip.com/target/0102y120009bx07xj4245.png,0,0,0,0,,,,{}
阮啸仙故居,Ruan Xiaoxian's Former Residence,3188678,39004517,23.852487,114.866834,文化古迹,,0.0,0,0.0,0,https://youimg1.c-ctrip.com/target/0101w1200096einb3DF09.png,0,0,0,0,2-4小时,"{'openStatus': '', 'openStatusType': 999, 'canSubscribed': False, 'hasSubscribed': False, 'likeCount': 0, 'isLiked': False, 'playSpendTime': '2-4小时'}",阮啸仙故居位于河源市东源县，始建于清代，历史悠久，坐北向南，三堂四横一后杠屋布局，占地面积三千多平米。,{}
黄海龙将军祠,Shrine of General Huang Hailong,4587393,51653860,23.663916,115.387416,演出场馆|文化古迹,,0.0,0,5.0,1,https://dimg04.c-ctrip.com/images/100b1f000001gk7mb6C94.jpg,0,0,0,0,,,,{}
崩凶嶂,Bengxiong Peak,83485281,83485281,24.4745,115.153991,,,0.0,0,4.8,5,https://youimg1.c-ctrip.com/target/fd/tg/g2/M0B/C4/B0/CghzgVW7H_uAYZlqAAAxbqRlqeE036.jpg,0,0,0,0,,,,{}
中山公园,,124907865,124907865,23.635477,115.173443,演出场馆,,0.0,0,0.0,0,https://youimg1.c-ctrip.com/target/01A5i12000a9m4q3512B4.jpg,0,0,0,0,,"{'openStatus': '开园中', 'openStatusType': 0, 'canSubscribed': False, 'hasSubscribed': False, 'likeCount': 0, 'isLiked': False, 'openTimeDesc': '全年 全天开放', 'openDateRuleInfo': [{'dateDesc': '全年', 'isCurrentTime': False, 'openWeekRuleInfo': [{'weekDesc': '全天开放'}]}]}",中山公园位于紫金县，公园依山而建，里面有篮球场和环形跑道，是人们锻炼休闲的好地方。,{}
紫金县博物馆,Zijinxian Museum,5703880,79437432,23.636138,115.185123,博物馆|演出场馆,,0.0,0,0.0,0,https://youimg1.c-ctrip.com/target/10011f000001gixlt3369.png,0,0,0,0,,,,{}
和平县图书馆,Heping Library,2680729,38491568,24.44158,114.938599,,,0.0,0,5.0,1,https://dimg04.c-ctrip.com/images/fd/tg/g1/M06/FC/25/CghzflW7IA-AKV6TAABByEo2c7Y435.jpg,0,0,0,0,,"{'openStatus': '今日已闭园', 'openStatusType': 1, 'canSubscribed': False, 'hasSubscribed': False, 'openTimeTips': '自助阅览室每天开放时间为8:30-22:00（全年无休），具体营业状态以当天开放情况为准。', 'likeCount': 0, 'isLiked': False, 'openTimeDesc': '全年 周一 周二-周日 08:30-12:00,14:30-18:00；自助阅览室每天开放时间为8:30-22:00（全年无休），具体营业状态以当天开放情况为准。', 'openDateRuleInfo': [{'dateDesc': '全年', 'isCurrentTime': False, 'openWeekRuleInfo': [{'weekTime': '周一', 'weekDesc': '不开放'}, {'weekTime': '周二至周日', 'weekDesc': '08:30-12:00,14:30-18:00'}]}]}",,{}
苏家围景区-河源市义江古寺,Sujiawei Jingqu-Heyuanshi Yijiang Gu Temple,4587423,51653919,23.842688,114.888459,,,0.0,0,0.0,0,https://dimg04.c-ctrip.com/images/fd/tg/g1/M03/FC/25/CghzflW7IAuAQo9CAAA7OIqXlVA798.jpg,0,0,0,0,1-2小时,"{'openStatus': '', 'openStatusType': 999, 'canSubscribed': False, 'hasSubscribed': False, 'likeCount': 0, 'isLiked': False, 'playSpendTime': '1-2小时'}",,{}
忠信镇花灯博物馆,Zhongxinzhen Huadeng Museum,4592418,51713384,24.206969,114.72459,博物馆|演出场馆,,0.0,0,0.0,0,https://youimg1.c-ctrip.com/target/01A5q12000a3avtdhC88A.jpg,0,0,0,0,,,,{}
龙川县博物馆,Longchuanxian Museum,64599585,64599585,24.097898,115.257936,,,0.0,0,4.0,1,https://dimg04.c-ctrip.com/images/fd/tg/g1/M08/AE/87/CghzfVW7IAOAbNKNAABCrs7mUrY425.jpg,0,0,0,0,1-2小时,"{'openStatus': '今日已闭园', 'openStatusType': 1, 'canSubscribed': False, 'hasSubscribed': False, 'likeCount': 0, 'isLiked': False, 'playSpendTime': '1-2小时', 'openTimeDesc': '全年 09:00-17:00', 'openDateRuleInfo': [{'dateDesc': '全年', 'isCurrentTime': False, 'openWeekRuleInfo': [{'weekDesc': '09:00-17:00'}]}]}",龙川县博物馆占地面积较广，馆内藏品类别有出土文物、民俗文物、陶瓷、近现代文物等。,{}
萧殷公园,Xiaoyin Park,4587467,51654038,24.100972,115.25862,演出场馆,,0.0,0,5.0,1,https://youimg1.c-ctrip.com/target/100g18000001470la1C55.jpg,0,0,0,0,2-3小时,"{'openStatus': '', 'openStatusType': 999, 'canSubscribed': False, 'hasSubscribed': False, 'likeCount': 0, 'isLiked': False, 'playSpendTime': '2-3小时', 'openTimeDesc': '具体营业状态以当天开放情况为准'}",萧殷公园是因园内有萧殷的汉白玉半身坐像而改为此名。公园整体秀丽幽静，春时莺啼婉转、夏日绿树成荫、秋时天高气爽、冬日银装素裹，甚是好看。,{}
河源市回龙寺,Heyuanshi Huilong Temple,4587502,51654112,24.371434,114.495651,演出场馆|文化古迹,,0.0,0,0.0,0,https://youimg1.c-ctrip.com/target/0ww5w120006o4fz9g68FD.jpg,0,0,0,0,0.5-1小时,"{'openStatus': '', 'openStatusType': 999, 'canSubscribed': False, 'hasSubscribed': False, 'likeCount': 0, 'isLiked': False, 'playSpendTime': '0.5-1小时'}",回龙寺起初是为感谢清代渔民李回澜所建的，原名为回澜宫，属于道教佛教混处的场所。,{}
春沐源智慧农业示范区,Chunmuyuan Smart Agriculture Demonstration Zone,64618638,64618638,23.608249,114.606972,,,0.0,0,5.0,4,https://youimg1.c-ctrip.com/target/100g1b000001bhkavE446.png,0,0,0,0,0.5-1天,"{'openStatus': '', 'openStatusType': 999, 'canSubscribed': False, 'hasSubscribed': False, 'likeCount': 0, 'isLiked': False, 'playSpendTime': '0.5-1天'}", 春沐源智慧农业示范区环境优美，交通方便，集观光，休闲，度假于一体。是体验农家乐，享受慢生活的好去处。,{}
黄氏大宗祠,,5719736,131915095,24.057732,115.19135,演出场馆|文化古迹,,0.0,0,3.0,1,https://youimg1.c-ctrip.com/target/010211200097e81kt9EEB.jpg,0,0,0,0,,,,{}
河源东江野战俱乐部,Dongjiang Yezhan Club,140573,101213,23.775132,114.753936,,,0.0,0,4.2,5,https://dimg04.c-ctrip.com/images/01015120009qxdehb3DFD.png,0,0,0,0,0.5-1天,"{'openStatus': '今日已闭园', 'openStatusType': 1, 'canSubscribed': False, 'hasSubscribed': False, 'likeCount': 0, 'isLiked': False, 'playSpendTime': '0.5-1天', 'openTimeDesc': '全年 09:00-18:00', 'openDateRuleInfo': [{'dateDesc': '全年', 'isCurrentTime': False, 'openWeekRuleInfo': [{'weekDesc': '09:00-18:00'}]}]}",俱乐部是目前全省规模较大，设备较先进、齐全的乐园。俱乐部坐落在河源东源东方红村，俱乐部距河源市区仅7公里，沿着滨江大道，穿过胜利大桥，驱车仅10分钟即可到达。俱乐部第一期占地200多亩，地理位置优越，依傍在东江河畔，毗邻大学城，与东江画廊、木京水电站隔江相望，交通方便。俱乐部集学生军训教育基地、野营、休闲娱乐等为一体，是您繁忙工作之余可以邀上三五知己一起聚会、娱乐休闲的好去处。                              俱乐部充分利用地形，共设有多种地形：有山地攻防战区、室内城市巷战区、反恐CS地道战区、对垒战区、丛林战区等等，可以根据自己的喜好选择不同的战区进行作战，绽放男人的粗旷和女性的飒爽英姿，在枪林弹雨中体验激烈与惊险！             俱乐部（河源东江军体素质培训基地）集国防教育、团队拓展、军事娱乐、学生军训、娱乐休闲等为一体。成为企业军事训练、户外拓展训练的理想场所。,{}
九和温泉,Jiuhe Hot Spring,51153,83670,23.446023,115.112148,,自流水温78℃－90℃,0.0,0,4.0,6,https://dimg04.c-ctrip.com/images/0103b120008g0582022F2.jpg,0,0,0,0,1小时,"{'openStatus': '', 'openStatusType': 999, 'canSubscribed': False, 'hasSubscribed': False, 'likeCount': 0, 'isLiked': False, 'playSpendTime': '1小时'}",被誉为“天下泉”的九和温泉，温泉自流水温78℃－90℃，储量大，自流量为4000吨／日，水质好。我国有名留日矿泉水专家陈炎冰，在1938年写《中国温泉时》，就把紫金九和温泉收入此书。考察过多个国家的张良博士认为，九和温泉比欧、美有名的温泉好。,{}
惠林汤泉,Huilin Tangquan Hot Springs,136090,97704,23.274144,114.647293,,,0.0,0,4.0,14,https://youimg1.c-ctrip.com/target/0101e120009516hvbD435.jpg,108.0,108.0,108.0,58.0,1天,"{'openStatus': '开园中', 'openStatusType': 0, 'canSubscribed': False, 'hasSubscribed': False, 'likeCount': 0, 'isLiked': False, 'playSpendTime': '1天', 'openTimeDesc': '全年 09:00-23:00（22:30停止入园）', 'openDateRuleInfo': [{'dateDesc': '全年', 'isCurrentTime': False, 'openWeekRuleInfo': [{'weekDesc': '09:00-23:00(最晚入园22:30)'}]}]}",惠林温泉地处惠州横沥镇矮陂黄沙洞，拥有国内屈指可数的优质温泉资源，是珠三角少有的、未被开发的原生态温泉资源。据勘测，惠林汤泉内温泉温度常年在60摄氏度-90摄氏度之间。惠林的天然环境得天独厚，周边层峦叠嶂，山清水秀，森林覆盖率高达93%，项目毗邻蓄水量达300万立方米的黄沙洞天然水库，湖水迤逦清澈，在上万亩天然水源林、四季常青的阔叶林环抱之中，宛如一块晶莹剔透的惊世玉宝。,{}
苏区革命旧址群,,134776122,134776122,23.36368,115.354434,,,0.0,0,5.0,1,https://dimg04.c-ctrip.com/images/fd/tg/g1/M00/FC/25/CghzflW7IAqAat3tAAAymFPzBHI728.jpg,0,0,0,0,,,,{}
