名称,英文名,id,poiID,经度,维度,标签,特色,价格,最低价格,评价分数,评论数量,封面图片,成人票价格,老人票价格,学生票价格,儿童票价格,建议游玩,开放时间,介绍,优待政策桂山大峡谷漂流,Guishan Grand Canyon Rafting,70429,10795376,23.723333,114.596648,游山玩水,,0.0,0,3.2,22,https://youimg1.c-ctrip.com/target/100f0g00000087qq040A1.jpg,129.0,129.0,129.0,129.0,2-3小时,"{'openStatus': '今日已闭园', 'openStatusType': 1, 'canSubscribed': False, 'hasSubscribed': False, 'openTimeTips': '开漂时间：上午11:00至12:00；下午14.:30至16:30', 'likeCount': 0, 'isLiked': False, 'playSpendTime': '2-3小时', 'openTimeDesc': '4月16日-10月31日 11:00-12:00,14:30-16:30；开漂时间：上午11:00至12:00；下午14.:30至16:30', 'openDateRuleInfo': [{'dateDesc': '4月16日-10月31日', 'isCurrentTime': False, 'openWeekRuleInfo': [{'weekDesc': '11:00-12:00,14:30-16:30'}]}]}",夏日酷暑，清凉桂山。位于风光秀丽的万绿湖桂山旅游区内的桂山大峡谷漂流，2010年以全新的面貌对外开放了。旅游区距市区约18公里，四季如春，漂流资源得天独厚，是原生态无紫外线的大峡谷探险漂流。漂流河道分四个区域：“象鼻山”、“情侣潭”、“跃马扬鞭”、“雾里看花”，全长约4公里，漂流全程约60分钟，落差80多米。沿河两岸，大面积森林不仅提供了清冽甘美的山水，还产生大量的空气负离子，凉风袭来，令人身心俱爽。穿梭于原始森林的峡谷中，任凭两岸绿色在眼前掠过，迎风扑浪，欢声笑语中将夹杂着你的惊呼尖叫声，这是桂山大峡谷,"{'儿童': [['儿童身高1.2米（含）', '免费'], ['身高1.2米（不含）-1.5米（不含）之间', '优惠票']], '老人': [['70周岁（含）', '免费'], ['70周岁（不含）', '优惠票']], '残疾人': [['凭相关证件免景区大门票', '免费']], '军人': [['凭相关证件免景区大门票', '免费']]}"
园中园,Heyuan Garden,51155,83672,23.591781,114.645797,演出场馆,,0.0,0,3.0,6,https://youimg1.c-ctrip.com/target/0107112000b2z26c0A437.jpg,0,0,0,0,1小时,"{'openStatus': '开园中', 'openStatusType': 0, 'canSubscribed': False, 'hasSubscribed': False, 'likeCount': 0, 'isLiked': False, 'playSpendTime': '1小时', 'openTimeDesc': '全年 全天开放', 'openDateRuleInfo': [{'dateDesc': '全年', 'isCurrentTime': False, 'openWeekRuleInfo': [{'weekDesc': '全天开放'}]}]}",园内有万株龙眼果园；千棵荔枝红荔园；一年四季百果园；百花仙子百花园；千姿百态植物园；枝繁叶茂桉树园。此外，万绿丛中，时隐时现的亭台楼阁，更为园中园增添色彩。还有园中湖，碧波粼粼、鱼跃鸭欢。湖边青柳桃红映，晨雾清风更自然。假日休闲，有兴可做姜太公，泛舟嬉水变顽童，其乐无穷。园中园地面是绿色的世界，地下蕴藏天然优质的矿泉。到此旅游，饮用和沐浴优质矿泉，健身益体，妙不可言。躲进树荫悠自行，忙里偷闲做神仙。花开果熟时节，万紫千红，花果飘香，蜂飞蝶舞，绘成一幅幅立体的画，无声的诗。置身其中，犹有一种回归自然之感。登高远眺，无限田园风光和滔滔东江尽收眼底，令人心旷神怡，留连忘返。,{}
和平热水漂流,Heping Hot Water Rafting,4477206,50614019,24.413377,114.827978,游山玩水,,0.0,0,1.0,2,https://youimg1.c-ctrip.com/target/0105s120008xmw9dv52BC.jpg,88.0,88.0,88.0,88.0,2-3小时,"{'openStatus': '今日已闭园', 'openStatusType': 1, 'canSubscribed': False, 'hasSubscribed': False, 'likeCount': 0, 'isLiked': False, 'playSpendTime': '2-3小时', 'openTimeDesc': '全年 11:00-16:00', 'openDateRuleInfo': [{'dateDesc': '全年', 'isCurrentTime': False, 'openWeekRuleInfo': [{'weekDesc': '11:00-16:00'}]}]}",和平热水漂流四面环山，青山绿水，赏景玩耍的好去处，值得一游。,{}
客天下梦幻冰雪乐园,,5712928,98540641,23.628009,114.630154,冰雪乐园,,0.0,0,1.0,5,https://youimg1.c-ctrip.com/target/01A01120008420fx43ED9.jpg,89.6,89.6,89.6,89.6,2-3小时,"{'openStatus': '今日已闭园', 'openStatusType': 1, 'canSubscribed': False, 'hasSubscribed': False, 'likeCount': 0, 'isLiked': False, 'playSpendTime': '2-3小时', 'openTimeDesc': '全年 10:00-18:00', 'openDateRuleInfo': [{'dateDesc': '全年', 'isCurrentTime': False, 'openWeekRuleInfo': [{'weekDesc': '10:00-18:00'}]}]}",客天下恐龙冰雪乐园位于河源市源城区，园内设有恐龙雪上游乐活动区、冰上过山车、滑道等多个玩乐项目；还有冰雕观赏区、雕刻体验区以及室内飘雪乐园等游乐区域。,{}
佗城东山寺,Tuocheng Dongshan Temple,51165,83682,24.056663,115.199984,演出场馆|文化古迹,,0.0,0,3.3,3,https://youimg1.c-ctrip.com/target/01A0912000a3fcr979F0C.jpg,0,0,0,0,1小时,"{'openStatus': '开园中', 'openStatusType': 0, 'canSubscribed': False, 'hasSubscribed': False, 'likeCount': 0, 'isLiked': False, 'playSpendTime': '1小时', 'openTimeDesc': '全年 全天开放', 'openDateRuleInfo': [{'dateDesc': '全年', 'isCurrentTime': False, 'openWeekRuleInfo': [{'weekDesc': '全天开放'}]}]}",“首营古寺在东山，底事钟鸣向暮间；一百八声声响后，僧人从此锁禅关。”这是“唐宋八大家”之一的苏轼被贬谪惠州到龙川游玩，在尽兴游览东山寺后写下的一首七言绝句。东山寺，座落在龙川佗城镇东瑶村，面向嶅山与东江，背靠东山岭，因此取名为“东山寺”。它始建于隋朝大业七年（公元611年），是一座历史悠久的古寺。东山寺大门正对着东江，一幅“山壮秀色迎宾客，寺院钟鼓念弥陀”的金色对联雕刻在大门两旁，尤显古朴而庄严。沿门而进，可见寺内种植着柳树、松柏等植物。东山寺是个三进院落四合院，建筑为硬山顶式，面积达500多平方米。寺内分别设有三宝殿、观音殿两个拜殿，二殿均设有两根粗而稳的门柱。三宝殿上摆放有如来佛祖、弥勒佛祖等五个栩栩如生的神像；观音殿的中间则摆着1个观世音，旁边也有近20个神态各异、活灵活现的神仙。寺内的门梁、屏风皆雕龙刻凤，精雕细琢。据该寺的看管者刘伯告知，几年前，在观音殿的前方摆放着一个洪钟与暮鼓，后来被人偷走。每当早晨敲钟、傍晚击鼓之际，方圆十里均可闻得晨钟、暮鼓之声。东山寺背靠郁郁葱葱、古木参天的东山岭，面向江风习习、江水细流、碧绿平静的东江，每当夕阳西下，僧侣上香诵经，暮鼓鸣响，百鸟归巢，农夫牵牛带锄而归，此情此景，尤为美丽。东山寺被列入龙川八景之一“东山暮鼓诵弥陀”。清康熙三十年（公元1691年），时任龙川县知县的王英，曾用一首《东山暮鼓诗》，将东山寺的壮观景象表现得淋漓尽致：“群山翠色远重重，中有楼如是梵宫。树影依微留晚照，钟声杳霭度天风。残烟渺渺连深谷，飞鸟翩翩入远空。此际余音尤可听，寥寥半在暮云中”。东山寺不仅是善男信女顶礼膜拜之地，也是尊师重教之居。名相吴潜罢官贬谪龙川期间（南宋景定三年，公元1261年），他在东山寺创设了“三沙书院”，又名“东山书院”，常偕士大夫、文人墨客在此讲授道经，并收取了过百名学生，为传播先进中原文化起到了一定作用。千年以来，东山寺的香火不断，不少群众不惜千里迢迢前来到此拜祭，以求得心里慰藉。但到了清末之后，战乱、天灾、人祸不曾断过，日益衰败，年久失修的东山寺也开始露出岁月的蚀迹，房顶、屋舍逐渐倒塌；1960年，东山寺遭遇灭顶之灾，一场罕见的暴风雨的突至，东山寺全面崩塌。幸好，在上个世纪80年代，社会民众为东山寺自愿捐资，在原址重建东山寺。现在的东山寺，虽不如前，但前往拜祭的脚步从未停止，东山寺又开始终日香烟缭绕……,{}
南园古村,Nanyuan Ancient Village,1408781,10775503,23.817291,114.777023,演出场馆|古镇古村,,0.0,0,3.7,17,https://youimg1.c-ctrip.com/target/100o070000002c5pq52DE.jpg,0,0,0,0,0.5-1天,"{'openStatus': '今日已闭园', 'openStatusType': 1, 'canSubscribed': False, 'hasSubscribed': False, 'likeCount': 0, 'isLiked': False, 'playSpendTime': '0.5-1天', 'openTimeDesc': '全年 08:30-17:00（17:00停止入园）', 'openDateRuleInfo': [{'dateDesc': '全年', 'isCurrentTime': False, 'openWeekRuleInfo': [{'weekDesc': '08:30-17:00(最晚入园17:00)'}]}]}",南园古村又名南园第一村(南国古村又名南国第一村)，位于中国河源仙塘镇红光村，由红光村委独立出资，是南中国现存规模大、历史悠久、文化底蕴深厚、具代表性的一个客家风水古村落，据古书记载：自唐开元二十六年！（公元738）建村以来，至今已有1200多年历史。“南园位于河源市区东北方向，居禾溪约中枢之地；东江水傍南园而过，甘泉滋润，仙气缭绕；其龙脉发源于碣砑山，绕行向西复自西而南，盘旋起伏，气势雄伟，绵垣不绝”数平方公里福地神龙环抱有情。南园古村落的客家民居古建筑多以府第式结构为主，讲究座向、主次对称、外型堂皇美观，多采用青砖为墙，雕梁画栋，工艺精美，一座大型的古民居建筑有上百个房间，可供一二十户上百户口人居住。厕所、柴草间、畜栏一般都在住座屋两侧一定距离的地方。具有代表性的就有“大夫弟”、“新衙门”、“老衙门”、“老楼”、“新楼”等。南园古村旅游区现由“大夫弟”、“新衙门”、“古炮楼遗址”、“老衙门”和“柳溪书院”等保存完好的客家古建筑遗产组成一个完整的村落，体现了其古民居建筑的特色和艺术、古村落出色的防御性及潘氏家族“忠孝传家、诗书启后”的家训。南园民居古建筑共有30多座，有客家围龙屋、雕楼、书院等其中多以府第式结构为主，讲究风水布局、主次对称、外型堂皇美观，多采用青砖灰瓦，雕梁画栋，工艺精湛，所体现的特色是：取材便利，楼体坚固牢靠、规模大、结构封闭一体，同时还体现了阴阳思想和儒道治家思想。具有代表性的就有“大夫第”、“新衙门”、“老衙门”“古炮楼遗址”、“柳溪书院”等。,{}
连平博物馆,Lianping Museum,1832034,24651230,24.363219,114.4907,博物馆|演出场馆,,0.0,0,4.1,14,https://youimg1.c-ctrip.com/target/0104812000atipca88B64.jpg,0,0,0,0,2-3小时,"{'openStatus': '今日已闭园', 'openStatusType': 1, 'canSubscribed': False, 'hasSubscribed': False, 'openTimeTips': '具体营业状态以当天开放情况为准', 'likeCount': 0, 'isLiked': False, 'playSpendTime': '2-3小时', 'openTimeDesc': '全年 09:00-11:30,15:00-17:00 周一；具体营业状态以当天开放情况为准', 'openDateRuleInfo': [{'dateDesc': '全年', 'isCurrentTime': False, 'openWeekRuleInfo': [{'weekDesc': '09:00-11:30,15:00-17:00'}, {'weekTime': '周一', 'weekDesc': '不开放'}]}]}",连平博物馆位于广东省连平县城南山公园内，集文物收藏、陈列、征集、保护、考古研究等功能为一体。主要陈列“三十六字官箴”和颜氏三代的题跋译文及颜氏三代传承官箴等。,{}
惠州中海汤泉,Zhonghai Huizhou Tangquan,22850,81230,23.202392,114.369979,体验慢生活,三面环山的泽谷中温泉沐浴,0.0,0,4.4,372,https://dimg04.c-ctrip.com/images/100r1f000001gopyc4414.jpg,188.0,188.0,188.0,0,1天,"{'openStatus': '开园中', 'openStatusType': 0, 'canSubscribed': False, 'hasSubscribed': False, 'likeCount': 0, 'isLiked': False, 'playSpendTime': '1天', 'openTimeDesc': '全年 09:30-23:30', 'openDateRuleInfo': [{'dateDesc': '全年', 'isCurrentTime': False, 'openWeekRuleInfo': [{'weekDesc': '09:30-23:30'}]}]}",汤泉位于惠城区小金口镇内，毗邻惠州大道，以温泉、冷泉、瀑布三位一体而著称。该区域隐匿于三面环山的泽谷中，拥有终年不竭的温泉水，仿佛汨汨涌出的液体金矿，自古以来就是远近闻名的温泉沐浴场所，大文豪苏东坡曾为汤泉留下了“汤泉吐艳镜光开，白水飞虹带雨来”的溢美之词，丝毫不为过。,"{'儿童': [['1.2米以下儿童可享受免票', '免费']]}"
客天下绿色庄园,,130874306,130874306,23.654556,114.622239,游山玩水,,0.0,0,4.5,2,https://youimg1.c-ctrip.com/target/0103g120009277v0yF66E.jpg,30.0,30.0,30.0,0,1-2小时,"{'openStatus': '今日已闭园', 'openStatusType': 1, 'canSubscribed': False, 'hasSubscribed': False, 'likeCount': 0, 'isLiked': False, 'playSpendTime': '1-2小时', 'openTimeDesc': '全年 09:00-18:00', 'openDateRuleInfo': [{'dateDesc': '全年', 'isCurrentTime': False, 'openWeekRuleInfo': [{'weekDesc': '09:00-18:00'}]}]}",田园花海位于国家4A级景区——河源客天下国际旅游度假区内，距离河源市中心仅40分钟车程；依托于悠久的客家农耕文化底蕴和优美的花卉草木自然风光，打造集生态旅游、生态农业示范、生态产品生产、研学科普，团队拓展为一体的多功能共融的自然乐园。田园花海配套设有，花海观光区、野炊烧烤区、休闲娱乐区、垂钓场等，是公司团体团建、亲子出游、休闲活动的理想场地。,"{'儿童': [['1.2米（不含）以下儿童', '免费']]}"
南昆山云顶温泉,Cloud Nine Hot Spring,1407154,10759261,23.575412,114.00437,体验慢生活|4A,原生态森林中的温泉,0.0,0,4.7,2600,https://dimg04.c-ctrip.com/images/100t0r000000hcyxqA40C.jpg,99.0,99.0,99.0,80.0,0.5-1天,"{'openStatus': '开园中', 'openStatusType': 0, 'canSubscribed': False, 'hasSubscribed': False, 'likeCount': 0, 'isLiked': False, 'playSpendTime': '0.5-1天', 'openTimeDesc': '7月4日-7月6日 08:00-23:59（23:00停止入园）；7月7日-12月31日 08:30-23:00', 'openDateRuleInfo': [{'dateDesc': '7月7日-12月31日', 'isCurrentTime': True, 'openWeekRuleInfo': [{'weekDesc': '08:30-23:00'}]}, {'dateDesc': '7月4日-7月6日', 'isCurrentTime': False, 'openWeekRuleInfo': [{'weekDesc': '08:00-23:59(最晚入园23:00)'}]}]}",云顶温泉坐落于南昆山的原生态森林环境之中，这里绿树环绕，空气清新。酒店有着浓浓的东南亚风格，建筑恢弘大气，提供优良的水质与高雅舒适的休闲环境。云顶温泉房型多样，在森林泡池房中，可以一边欣赏远处山峦起伏之景，一边享受惬意的温泉体验。温泉区内设有多种泡池，酒杯池等，水上乐园、烧烤区等设施也是一应俱全。,"{'儿童': [['1.2米(含)-1.5米(不含)', '优惠'], ['1.2米以下(不含)', '免费']]}"
